title,content,author,category,published_date,page_url
Parliament has collapsed; no law is functioning - Michael Okyere Baafi claims,"The Member of Parliament for New Juaben South Constituency in the Eastern Region, Michael Okyere Baafi, has issued a strong criticism of the current state of parliamentary affairs, claiming that Parliament has collapsed and that no law is working in the House now.
Speaking in an interview on Accra 100.5 FMs Ghana Yensom morning show hosted by Chief Jerry Forson, the MP defended the recent confrontational actions of the Minority in Parliament, stating that they feel silenced and powerless under current conditions.
According to Okyere Baafi, the Minority believes they must adopt a more aggressive approach because lawful parliamentary procedures and Standing Orders are no longer being respected.
We have decided to go violent until we are heard, he declared, adding that the mechanisms that previously governed the House are no longer functional.
When the host questioned how Parliaments Standing Orders which formerly ensured order and fairness had become ineffective, Baafi insisted that Ghanas parliamentary democracy had deteriorated.
Parliament has collapsed. There is no law working in Parliament. The democracy of Ghana has really fallen. The laws in Parliament are no longer functioning, he said.
He further alleged that there is an agenda by certain forces within Parliament aimed at sidelining the entire Minority Caucus.
According to him, the plan was to remove Minority MPs and trigger by-elections in their constituencies, a move he believes could shift national political control.
Their aim is for Parliament to take all the Minority MPs out so they can declare by-elections in our constituencies.
Then the NDC can control Ghana.
When there is no Minority, they can do whatever they want, he explained.
Okyere Baafis remarks have intensified public discussions about the stability of Ghanas parliamentary system and the growing tensions within the House.",,Politics, 11 December 2025,https://www.ghanaweb.com/GhanaHomePage/politics/Parliament-has-collapsed-no-law-is-functioning-Michael-Okyere-Baafi-claims-2013153
3 candidates in the race as EC schedules Kpandai parliamentary rerun,"The Electoral Commission (EC) has formally declared that the Kpandai Constituency currently has no Member of Parliament.
In a statement issued on Wednesday, December 10, 2025, the Commission said the decision follows a ruling by the Tamale High Court on Monday, November 24, 2025, which ordered a rerun of the Kpandai Constituency parliamentary election within 30 days.
The EC further disclosed that it received official correspondence from the Clerk to Parliament on Tuesday, December 9, 2025, notifying the Commission of the vacancy in the membership of Parliament arising from the courts decision.
Consequently, the EC confirmed that the Kpandai parliamentary seat has become vacant.
The Jean Mensa-led Commission announced that the rerun of the parliamentary election in the Kpandai Constituency will take place on Tuesday, December 30, 2025.
According to the EC, the rerun will be contested exclusively by the three candidates who participated in the 2024 parliamentary election in the constituency.",,Politics, 11 December 2025,https://www.ghanaweb.com/GhanaHomePage/politics/3-candidates-in-the-race-as-EC-schedules-Kpandai-parliamentary-rerun-2013152
Why NDC's Daniel Wakpal has sued EC Chairperson Jean Mensa,"Daniel Nsala Wakpal, the 2024
National Democratic Congress
parliamentary candidate for Kpandai, has sued the Chairperson of the
Electoral Commission
,
Jean Mensa
, for allegedly failing to comply with a High Court order.
According to a report by 3news.com, in an affidavit sworn before a Commissioner for Oaths in Accra on Wednesday, December 10, 2025, Wakpal said that although
Jean Mensa
had been served notice of the court's decision, she had shown no sign of implementing it.
He further described her failure to act on the order as a deliberate disregard for the High Courts decision.
Tamale High Court sets December 18 for ruling on Kpandai MP's stay of execution
The report noted that Wakpals legal team argued that such conduct constitutes contempt of court, as it directly contradicts an order issued by a competent judicial authority.
The affidavit calls for the EC Chair to be held accountable for failing to adhere to the courts ruling'.
Parliament has formally notified the EC of a vacant seat in  Kpandai.
This follows a Tamale High Court's order for the Commission to rerun the 2024 parliamentary election.
Parliament, in a letter dated December 4, 2025, signed by Clerk to Parliament Ebenezer Ahumah Djietror, formally notified the EC.
'Fight' breaks out in Ghana's parliament
Meanwhile, the Tamale High Court is set to deliver its ruling on December 18, 2025, regarding an application for a stay of execution filed by Kpandai Member of Parliament Mathew Nyindam.
JKB/AM
From Protests to Pushes: Parliament of Ghana's 5-year chaos record",,Politics, 10 December 2025,https://www.ghanaweb.com/GhanaHomePage/politics/Why-NDC-s-Daniel-Wakpal-has-sued-EC-Chairperson-Jean-Mensa-2013142
Tamale High Court sets December 18 for ruling on Kpandai MP's stay of execution,"The Tamale High Court Commercial Division has scheduled December 18, 2025, for a ruling on the application for a stay of execution filed by lawyers representing embattled Kpandai Member of
Parliament
, Mathew Nyindam.
According to a report by 3news.com, lawyer for the petitioner, George Kodzo Adabadze, argued that Nyindam has not presented any compelling legal grounds to warrant a stay of execution while the appeal is pending.
Kyei-Mensah-Bonsu casts doubt on Bagbin's handling of Kpandai vacancy seat case
We are confident that my Lord will rule in our favor, one lawyer said. He added, The law is clear that unless a stay of execution is granted, nothing prevents the Electoral Commission from proceeding with a rerun of the election. Politics is different from law, and the law is clear.""
On January 30, 2025, the
National Democratic Congress
(NDC) parliamentary candidate in the 2024 Election, Daniel Nsala Wakpal, filed a petition at the Tamale High Court challenging the declaration of
New Patriotic Party
s Mathew Nyindam as Member of
Parliament
-elect for the Kpandai Constituency.
'Fight' breaks out in Ghana's parliament
According to the petition, the parliamentary election results were invalid due to irregularities and inconsistencies in some of the pink sheets.
The suit highlighted that Forms 8A (Regulations 32(7) and 39(2)) for 41 out of 152 polling stations contained discrepancies.
Wakpal argued that the December 7 election violated Regulation 39 of the Public Elections Regulations 2020 (CI 127), affecting the outcome of the vote.
He sought an order from the High Court to nullify the declared results in the affected polling stations and mandate a rerun of the election in those areas.
The court president over by Justice Emmanuel Brew Plange, nullified the parliamentary election results and ordered a fresh poll within 30 days.
Following the ruling, lawyers for Nyindam filed for a stay of execution pending the determination of the appeal.
Meanwhile,
Parliament
has officially notified the Electoral Commission (EC) of a vacancy in the Kpandai Constituency following the court's order.
JKB/AE
Also, watch below Amnesty International's 'Protect the Protest' documentary as the world marks International Human Rights Day 2025",,Politics, 10 December 2025,https://www.ghanaweb.com/GhanaHomePage/politics/Tamale-High-Court-sets-December-18-for-ruling-on-Kpandai-MP-s-stay-of-execution-2013107
Sky Train Case: AG first witness ordered to produce 16 emails,"An Accra High Court presided over Justice Audrey Kokuvie-Tay has ordered the first prosecution witness in the case of the Republic versus Solomon Asamoah and another (Sky Train Case), Yaw Odame-Darkwa, to retrieve and produce some 16 emails he received from the former Chief Executive Officer, CEO of Ghana Infrastructure Investment Fund (GIIF), Solomon Asamoah to the Court at its next sitting on Tuesday, 16 December 2025.
The Court made the order after the defence lawyer (lawyer for the 1st accused), Victoria Barth Esq., sought to confirm from the prosecution witness, Odame-Darkwa, if he indeed received those emails that pertained to the Sky Train project from the CEO, Solomon Asamoah, when he served as a member of the board of directors of GIIF.
Victoria Barth requested that the prosecution witness retrieve the emails from his smartphone, which he had brought to court, since the email addresses were Yahoo and Gmail accounts that could easily be accessed on a smartphone or laptop with internet provided by the court.
However, Odame-Darkwa told the Court that in this age of AI, anything is possible, and he preferred to retrieve the emails using his own computer and internet access point rather than any device or network provided by another source.
Witness statement
From paragraphs 10 to 14 of his 16-paragraph witness statement, Yaw Odame-Darkwa stated as follows:
During my tenure, the Board approved funding for several infrastructure projects.
I wish to state that the Sky Train concept was only introduced at one of our Board meetings.
The Board did not receive any substantive proposal on the Sky Train project, and hence we did not deliberate or take any decision on the project.
Additionally, the Investment Committee did not recommend the Sky Project to the Board for approval.
To the best of my knowledge, the Sky Train project has not been tabled for consideration at any Board Meeting.
If the emails that the defence lawyers are seeking to confirm are valid, it will effectively render the evidence of the 1st prosecution witness (Yaw Odame-Darkwa) that he never heard of the Sky Train project until the Auditor Generals report was released, completely inconsistent with the truth.
Cross-examination
During the continuation, Yaw Odame-Darkwas cross-examination in Court on Wednesday, 10 December 2025, Victoria Barth first asked;
Question: Before board meetings were held to discuss new projects or existing projects, there would usually be a preceding meeting of the investment committee (IC) of the board of GIIF. Is that not so?
Answer: Because you used usually, the answer is yes.
Question: The investment committee of which you were a member would usually receive an e-mail notice from either the acting secretary, Kofi Boakye, the CEO (A1), or Harriet Aban, the substantive company secretary. Is that correct?
Answer: Yes
Question: These e-mail notices would usually include the agenda and documents or board pacts for the upcoming meeting of the investment committee. Is that not so?
Answer: Yes
Question: During your tenure on the board of GIIF, some of the projects that the IC considered at its meetings included the Safari Hotel project, Maha Hotel Resort, Woodfields (Fidelity) Tank Farm, and Emirates Capital. Is that correct?
Answer: Yes
Question: I am going to show you some e-mail correspondence on the meeting of the IC on 31/7/18 and 28/718, which dealt with some of the projects I have just mentioned to you.
First, Im showing you an email from Saturday, July 28, 2018, sent at 6:48 pm on the subject Investment Committee 31 July 2 pm from Solomon Asamoah to you and other board members.
There are other emails following up on Monday 30 July at 10:27 am with an attached portfolio update report. These are emails that you received, is that not so?
Answer: That is what it looks like. I would need time to look at it and confirm.
Question: Have you deleted the e-sims that you received while you were at the GIIF board from your e-mail account?
Answer: No.
Question: So, if this court provides a computer with internet access, you would be able to retrieve these emails from your inbox even now, is that not so?
Answer: Not now
Question: If the first accused is called upon to go into his e-mail account on a device provided by the court with internet access right now and the emails are retrieved, would that help you confirm that you received these emails?
Answer:
In this era of AI, anything can be done. So, Ill trust what I would retrieve from my own mail. That is, Im asking the court to give me time to go through my personal e-mail.
Question: Yaw Odame-Darkwa, time is of the essence, and there are many emails to be shown to you. So, it should be possible for you right here and right now to go into that smartphone of yours and retrieve the emails in question. Is it not possible?
Answer: My Lady, it is not possible because Im not using that e-mail right now, and I cannot access it now.
Question: You have internet access on your phone, dont you?
Answer: Yes
Question: Your e-mail addresses are a Yahoo e-mail address and a Gmail address, is that not so?
Answer: Yes
Question: You are aware that you can access your e-mail address by going online to sign in to Yahoo, are you not?
Answer: Yes, Im aware.
Question:  Then, for the sincerity of that e-mail in your account to be preserved, I am suggesting that it must be retrieved right now from your phone. Im suggesting to you that it is possible to retrieve it from your phone right now.
Answer: My Lady, it is not possible.
Request for court order
To this end, Victoria Barth prayed the court to order the witness to access those emails with internet support that would be provided to him.
However, principal state attorney Sefakor Batse urged the court to allow the witness to independently retrieve the emails and supply the same to the court at the next adjourned date.
a href=""https://www.ghanaweb.com/GhanaHomePage/business/I-m-not-in-hiding-in-Senegal-Former-GIIF-CEO-breaks-silence-on-2m-Sky-Train-scandal-1977072"" target=""_blank"">' I'm not in hiding in Senegal'  Former GIIF CEO breaks silence on $2m Sky Train scandal
Victoria Barth further indicated in court that to enable the witness to do a comprehensive verification, she provided specific details of the 16 emails the defence is seeking to retrieve from the e-mail of the witness.
By Court
Flowing from the cross-examination and submission of learned counsels, it is my considered view that the witness should be given time to verify and confirm, and if possible, also produce that which requires an evaluation.
In the circumstances, the witness would be ordered to provide them on the next date, which is 15 December 2025, Justice Audrey Kokuvie-Tays court ruled.
Background
In 2019, the Ghana Infrastructure Investment Fund (GIIF) invested US$2 million for a 10% stake in Africa Investor Skytrain Consortium Holdings (Ai Skytrain), the company developing Accras Skytrain light railway project.
The Africa Investor Group (the Sponsors) was selected and granted the rights to develop the project by the Government of Ghana (GoG) through the Ministry of Railways Development (MORD).
At the time, the Chairman of GIIF was Professor Christopher Ameyaw-Akumfi, and the Chief Executive Officer (CEO) was Solomon Asamoah.  T
he Chairman had previously been a member of the GoG.  Asamoah was an international development banker who had been head-hunted into the position from a UK recruitment agency.
a href=""https://www.ghanaweb.com/GhanaHomePage/NewsArchive/Accra-Sky-Train-Project-GIIF-CEO-Asamoah-granted-GH-15m-bail-Ameyaw-Ekumfi-absent-1983887"" target=""_blank"">Accra Sky Train Project: GIIF CEO Asamoah granted GH15m bail, Ameyaw-Ekumfi absent
Following a change of government in Ghana in December 2024, the GoG, through the office of the Attorney General of Ghana, now alleges that this action was taken without Board approval, resulting in a willful financial loss to the state, as there is as yet no railway built.
It should be noted that there are no allegations of personal gain or diversion of funds in the charges, and the state has not charged anyone from MORD or the GoG-selected sponsors; only the GIIF Chairman and CEO have been charged.
The state witnesses who initially faced charges of causing financial loss to the state themselves dropped these charges after stating they did not approve the project, casting significant doubt on the reliability of their statements.
The prosecutions case is built almost entirely on these statements to show that a legitimate transaction was unauthorised, without which there would be no case to answer.
The prosecutions case appears to be politically motivated, intended to fulfil a campaign promise to prosecute members of the previous government. It is unsupported by the facts, relying on demonstrably false witness statements, a lawyer familiar with the case stated on condition of anonymity.
Also, watch below Amnesty International's 'Protect the Protest' documentary as the world marks International Human Rights Day 2025",,Politics, 10 December 2025,https://www.ghanaweb.com/GhanaHomePage/politics/Sky-Train-Case-AG-first-witness-ordered-to-produce-16-emails-2013104
"Ofori-Atta did well in the first term, but we did not want him again - Effia MP","The Effia Member of Parliament, Isaac Boamah-Nyarko, has shared that former Mi ister of Finance
Ken Ofori-Atta
was not the preferred choice of many within the
New Patriotic Party
(NPP) government for the second term of the former Akufo-Addo administration.
Speaking candidly on JoyPrime on Wednesday, December 10, 2025, Boamah-Nyarko said that while Ofori-Atta played a crucial role in the early years of the government, by the time the 2020 Election were over, internal confidence in his leadership at the finance ministry had waned significantly.
Four high-profile corruption cases
Ken Ofori-Atta
is wanted for
Boamah Nyarko noted that Ofori-Atta brought energy and momentum during the NPPs first term, driving several key reforms and contributing to the administrations early successes.
From the beginning of government in 2017, when we came to power, everybody could see the energy, the strength, the transformation that his first two, three years commanded, he stated.
However, he explained that by the end of the first term, persistent public concerns and internal dissatisfaction over his management style suggested that a change would have been more appropriate heading into the second term.
I believe that the second half of the year, a lot of the challenges that were coming up, where people's complaints centered around the way and manner he was running the ministry, that was where we needed a change, he shared.
Boamah-Nyarko acknowledged Ofori-Attas competence but stressed that staying on as finance minister in former President Akufo-Addos second term was not the expectation or desire of many within the government.
He can be, and is, a fine finance minister, but he got a lot of other things wrong... He [Ofori-Atta] wasn't the one we wanted, he stated.
Ken Ofori-Atta
declared wanted on INTERPOL's Red Notice list
He described it as a normal part of governance for leaders to lose momentum over time, saying that after years of intense pressure, it was natural for the minister to be allowed to step aside.
As a government, you can't be best all the time... after a while, youd have gotten exhausted with ideas and you move on to another challenge, he noted.
Ken Ofori-Atta
did well in his first tenure, but in the second tenure, he wasnt the one we wanted  Isaac Boamah-Nyarko, MP, Effia Constituency
#PrimeMorning
pic.twitter.com/czkyh2QZcy
 Joy Prime (@JoyPrimeTV)
December 10, 2025
MAG/AE
Also, watch below Amnesty International's 'Protect the Protest' documentary as the world marks International Human Rights Day 2025",,Politics, 10 December 2025,https://www.ghanaweb.com/GhanaHomePage/politics/Ofori-Atta-did-well-in-the-first-term-but-we-did-not-want-him-again-Effia-MP-2013082
'Parliament on the verge of committing constitutional travesty' - Minority on Kpandai seat,"The Minority Caucus in
Parliament
has criticised ongoing moves to declare the Kpandai parliamentary seat vacant, describing the development as a direct assault on constitutional governance and a dangerous precedent for Ghanas democracy.
Addressing the press on Wednesday, December 10, 2025, the Deputy Minority Leader
Patricia Appiagyei
delivered a strongly worded statement condemning actions taken by parliamentary leadership and the Clerk of
Parliament
following a contested High Court ruling on the Kpandai seat.
'Fight' breaks out in Ghana's parliament
According to Appiagyei,
Parliament
risks a constitutional travesty and a historical self-betrayal if it proceeds on the basis of the Clerks notification to the Electoral Commission (EC), which signals that the Kpandai seat has become vacant.
... A direct assault on the constitutional rights of the people of Kpandai, a dangerous breach of the separation of powers in the redress, and a reckless disregard for both our judicial process and our own parliamentary history. This House is on the verge of committing a constitutional travesty and a historical self-betrayal, she said.
She argued that the Clerks letter, issued in response to a High Court order currently under challenge, cannot form the basis for declaring the seat vacant, especially when the New Patriotic Partys (NPP)
Matthew Nyindam
, who won the seat by 3,734 votes, has already triggered legal processes to halt the judgment.
We have taken note of a formal communication from the Clerk of
Parliament
, issued pursuant to the contested High Court order notifying the Electoral Commission of a vacancy in this Honorable House.  On the strength of that notification alone, the Electoral Commission is expected to regard the Kpandai
Parliament
ary Seat as vacant though it is a seat that was decisively won by the New Patriotic Party with a clear and commanding mandate of a difference of 3,734 votes, the Minority argued.
Appiagyei stressed that the courts decision is not final, citing the MPs filing of a stay of execution, a legal step that seeks to suspend the enforcement of the ruling until further judicial review is complete.
As I stand before you, the honorable member for Kpandai,
Matthew Nyindam
has duly exercised his constitutional rights. He has filed a stay of execution halting by the oppression of law, the effect of that very judgment, they submitted.
Kyei-Mensah-Bonsu casts doubt on Bagbin's handling of Kpandai vacancy seat case
The Minority contends that proceeding with the declaration despite the pending stay application undermines the separation of powers, interferes with judicial processes, and disenfranchises the people of Kpandai.
MAG/MA
Also, watch below Amnesty International's 'Protect the Protest' documentary as the world marks International Human Rights Day 2025",,Politics, 10 December 2025,https://www.ghanaweb.com/GhanaHomePage/politics/Parliament-on-the-verge-of-committing-constitutional-travesty-Minority-on-Kpandai-seat-2013075
