title,content,author,category,published_date,page_url
'Akufo-Addo could have cleared out NDC leadership' - Fatimatu on double salary scandal,"Former Minister of Information, Fatimatu Abubakar, has criticised the ruling National Democratic Congress (NDC) over what she describes as the unfair treatment of former appointees of the erstwhile
New Patriotic Party
(NPP) government who have been accused of corruption.
Speaking on a panel discussion on Movement TV on December 6, 2025, she argued that bail conditions for appointees facing corruption and related charges have now become excessively high, suggesting these measures are being used as punishment rather than a judicial requirement.
According to her, she has lost hope in the country because the legal fraternity has become politicized, especially in the handling of cases involving politically exposed persons.
Abubakar further claimed that former President
Nana Addo Dankwa Akufo-Addo
, under the NPP administration, could have sanctioned the entire leadership of the NDC Members of Parliament (MPs) over the alleged double salary scandal but chose to exercise restraint.
When we were in government, there was the double salary scandal. They had more than fifteen MPs implicated and other issues. If we had taken action, by now almost the entire front bench of the Majority would have been in Nsawam. But the President didnt want that. How do you wipe out the leadership of a whole political party in the name of double salary? she questioned.
She added that despite the governments restraint at the time, todays bail conditions for political appointees are set as high as GH800,000, which she believes reflects political motivation rather than fairness.
I have lost hope in Ghana because it is glaring that what is happening is politically motivated. I have heard the national chairman of the NDC listing all the top political appointments they will sack from the Chief Justice to the Electoral Commission, she claimed.
The double salary issue first surfaced when reports emerged that about 48 Members of Parliament, who served as ministers under then former President
John Dramani Mahama
s administration, had allegedly received double salaries.
The Criminal Investigations Department (CID) of the Ghana Police Service subsequently opened investigations into the claims.
Earlier reports suggested that 25 MPs were invited by the CID for questioning, although further documentation indicated that nearly 48 former NDC appointees were involved with some allegedly admitting to receiving double payments.
The alleged conduct violates Section 124 (1) of the Criminal and Other Offences Act, 1960 (Act 29), which deals with stealing.
Data showed that several ministers took double salaries between 2012 and 2016, with some receiving double payments monthly throughout their tenure. Others did so for shorter periods due to reshuffles.
FLASHBACK: Ex-Ministers exposed in double pay scandal
However, the CID later clarified that investigations had not been suspended, contradicting claims by the then minority MPs who accused the CID of embarrassing them by publicly inviting them for questioning.
The development reportedly caused tension within the NDC. The then Second Deputy Speaker of Parliament and MP for Nadowli/Kaleo, Alban Bagbin, took to Twitter in April 2018, expressing anger at what he suggested were internal leaks to the CID.
If anybody thinks that leaking our names to the police CID thwarts our chances and advances their selfish claim to leadership in our party, then think again. Because when we go down, we go down together, he tweeted at the time.
AM
#TrendingGH: Extension of IGP's contract draws praise and criticism
Watch some videos from the NPPs 2025 Constitution Amendment
The wait is over! The GhanaWeb Excellence Awards 2025 is officially launched. Let's Celebrate impact, innovation and excellence across Ghana.
Who deserves to be honoured this year?
Nominate now 
https://ghanaweb.com/ghanaexcellenceawards/nominate",,Politics, 10 December 2025,https://www.ghanaweb.com/GhanaHomePage/politics/Akufo-Addo-could-have-cleared-out-NDC-leadership-Fatimatu-on-double-salary-scandal-2012987
'His fight is our fight'  NPP backs Nyindam amid declaration of vacant seat,"The
New Patriotic Party
(NPP) has reaffirmed its support for the embattled Member of Parliament for the Kpandai Constituency, Matthew Nyindam, following the declaration of his seat as vacant.
At a press conference in Accra on Tuesday, December 9, 2025, the National Organiser, Henry Nana Boakye said the party stands firmly behind Nyindam.
Gary Nimako slams Parliament for hasty declaration of vacant seat in Kpandai
The NPP stands as one solid rock behind the MP for Kpandai, Matthew Nyindam. His fight is our fight, his cause is our cause, and his cause will be the cause of every NPP member. Do not lose heart.
""The NPP has not abandoned you. We have not retreated. We are with you completely and unfailingly. We will walk every step of this legal journey with you. We will fight in every court, at every hour, with a calculated agenda, he emphasised.
Kpandai MP speaks on High Court's election rerun decision
Parliament has officially notified the Electoral Commission (EC) of a vacancy in the Kpandai Constituency following a court ruling ordering a re-run of the 2024 parliamentary election in the area.
JKB/AM
Former President Kufuor shares how he became a Catholic and a Freemason",,Politics, 10 December 2025,https://www.ghanaweb.com/GhanaHomePage/politics/His-fight-is-our-fight-NPP-backs-Nyindam-amid-declaration-of-vacant-seat-2012986
NPP's Jennifer Queen descends into the gutters with Krontihene of Akyem Asuom,"A Deputy Communications Director of the
New Patriotic Party
(NPP), Jennifer Oforiwaah Queen, has lambasted the Krontihene of Akyem Asuom, Nana Boadi Amponim Obo-Dade III, over his recent claims that none of the aspirants in the NPP presidential race is qualified to lead the country as president.
Responding to the chief in an interview on Angel TV on December 9, 2025, Jennifer Queen described his comments as filthy.
According to her, she cannot fathom the motivation behind what she called a reckless statement from the traditional leader.
She stated that even if the chief had taken tramadol, she does not believe he would have spoken in such a manner.
Even President Mahama, if Dr Bawumia does something he doesnt like there is a way he would address the issue without openly insulting Dr Bawumia.
President Mahama himself would not insult President Nana Addo Dankwa Akufo-Addo, so how much more you, a chief in a small space who has even been destooled, speaking such filthy words to the party?
Dressing indecently like that and insulting us... The way he is ranting and saying these things, I dont know what is wrong with him, whether he has taken red or something and even that, I doubt he would make such a reckless statement.
The quality of candidates contesting the NPPs flagbearer race has been criticised by the Nana Boadi Amponim Obo-Dade III.
According to the traditional leader, none of the five aspirants demonstrates the leadership depth or character required to lead Ghana as president.
Speaking to the media on December 7, 2025, Nana Boadi Obo-Dade III, known for his blunt commentary on national issues, described the aspirants as sankwas, a term he used to suggest they are unfit for the role.
Why the five NPP presidential candidates dont qualify to be president - Obo-Dade III explains
He contrasted them with past leading figures of the party such as JB Danquah, Victor Owusu, Kofi Busia, Prof Adu-Boahen, Peter Ala Adjetey and JA Kufuor, arguing that the NPP has suffered a decline in leadership quality.
The NPP is scheduled to hold its flagbearer primary on Saturday, January 31, 2026.
The contest features five well-known party figures including former Assin Central MP Kennedy Agyapong, Abetifi MP and former Minister for Agriculture, Dr Bryan Acheampong, former Vice President and 2024 presidential candidate, Dr Mahamudu Bawumia, Bosomtwe MP and former Education Minister, Dr Yaw Osei Adutwum and former NPP General Secretary, Kwabena Agyei Agyapong.
@trendz.ghana
Must watch : Jennifer Queen goes hard on Krontihene of Akyem Asuom Nana Boadi Amponim Obo-Dade III,for saying all the NPP presidential candidates hopefuls are  SANKWAS 
#tredzghana
#viralreels
#viral
#NPP
#Bawumia2028
 original sound - Trendz Ghana
AM
Also, watch below Amnesty International's 'Protect the Protest' documentary as the world marks International Human Rights Day 2025",,Politics, 10 December 2025,https://www.ghanaweb.com/GhanaHomePage/politics/NPP-s-Jennifer-Queen-descends-into-the-gutters-with-Krontihene-of-Akyem-Asuom-2012985
NDC wants super Majority to push constitutional amendments - Nkrumah alleges,"The Member of Parliament for Ofoase Ayirebi,
Kojo Oppong Nkrumah
, has accused the governing
National Democratic Congress
(NDC) of pursuing a calculated plan aimed at securing a dominant majority in Parliament to enable changes to the Constitution.
Speaking to journalists in Parliament on December 9, 2025, Oppong Nkrumah compared the current developments to earlier controversial exits in Ghanas public service.
He recalled that before the NDC assumed office, there was what he described as an openly signalled agenda to remove the Chief Justice, which was later carried out under the cover of due process.
'Fight' breaks out in Ghana's parliament
According to him, a similar approach is now being applied to the Electoral Commission.
There is a pre-advertised agenda to remove the EC Chairperson and her deputies. It is being carefully rolled out, and they will keep saying it is all about procedure. If anyone still doubts us, we are saying clearly that there is an agenda to secure an overwhelming majority in this House for the purpose of constitutional amendments, he stated.
Oppong Nkrumah also assured that the Minority will remain resolute and will continue to caution Speaker Alban Bagbin against any pressure to declare the Kpandai seat vacant, stressing that the Speaker has already ruled on the issue.
All we can do is to stand firm and remind Mr Speaker not to give in to any pressure to declare the seat vacant, because he has already made a decision on the matter. No amount of pressure should cause him to reverse that ruling, he said.
His statement come at a time of rising tension in Parliament, following a standoff in which Minority MPs prevented Majority Leader Mahama Ayariga from addressing calls for the withdrawal of a letter that declared the Kpandai parliamentary seat vacant.
The situation led to a temporary suspension of proceedings after Minority MPs, clad in black, chanted slogans, banged tables, and disrupted the sitting.
At the centre of the dispute is a letter dated December 4 from the Clerk of Parliament to Electoral Commission Chairperson Jean Mensa, notifying her of the vacancy of the Kpandai seat after a High Court decision.
The Minority has described the letter as inappropriate and regrettable, arguing that it undermines the rule of law.
Watch the video below:
@channel1tvgh
We are left with no choice but to withdraw cooperation.
Kojo Oppong Nkrumah
, MP for Ofoase- Ayirebi reacts to the Kpandai seat vacancy controversy in Parliament, accusing the NDC of a grand scheme for absolute power emphasizing that procedures are being used to perpetrate injustice. #Kpandai #GhanaPolitics #KojoOppongNkrumah #ParliamentDrama #ChannelOneNews #ChannelOneTV
 original sound  - Channel One TV
'You cannot scare anybody here' - Minority chief whip on Kpandai seat dispute
AK/AM",,Politics, 10 December 2025,https://www.ghanaweb.com/GhanaHomePage/politics/NDC-wants-super-Majority-to-push-constitutional-amendments-Nkrumah-alleges-2012984
'Don't put a microphone in my mouth and call me honourable' - Ahiafor chides Journalist,"The First Deputy Speaker of Parliament,
Bernard Ahiafor
, sharply declined an interview request on Tuesday, insisting that the journalist who approached him breached parliamentary protocol.
After chaos erupted in the chamber during proceedings on Tuesday, December 9, 2025, TV3s correspondent, Christian Yalley, approached
Bernard Ahiafor
who was in the company of some Majority MPs and police officers to seek clarification on the incident.
However, Ahiafor, who also doubles as the Member of Parliament for Akatsi South, rebuked the journalist, stating, You know the procedure. As a speaker, to speak, you know the procedure to follow. I am not the type that you can put a microphone in my mouth and say, Honourable, Honourable. No. Stop this.
Chaos has erupted in Ghanas Parliament during proceedings on Tuesday, after members of the Minority Caucus abandoned their seats and massed at the centre of the chamber.
The disturbance flared during heated exchanges over the declaration of the Kpandai parliamentary seat as vacant, a decision the Minority maintains is unlawful and procedurally flawed.
Before the confrontation, Majority Leader Mahama Ayariga had dismissed what he described as the Minoritys continuous and orchestrated protest, insisting he was not surprised by their attempts to obstruct parliamentary business.
The Bawku Central MP accused the Minority of deliberately derailing parliamentary work over the contested Kpandai seat, arguing that the caucus had resorted to noise-making and unruly behaviour to prevent the Speaker from delivering rulings.
However, Minority Chief Whip Frank Annoh-Dompreh countered sharply, warning that government business would continue to suffer until the Kpandai matter is resolved.
Moments after his remarks, tensions escalated.
'Fight' breaks out in Ghana's parliament
Despite the Speakers attempts to proceed, Minority MPs intensified their protest, rising from their seats, marching into the middle of the chamber and chanting in opposition.
The sudden movement triggered a chaotic confrontation, with MPs from both sides surging toward the centre of the floor.
GhanaWeb cameras captured dramatic scenes inside the chamber as MPs in a heated face-off, papers flying through the air and the Member of Parliament for Assin South, Rev Ntim Fodjour, seen angrily yelling at a colleague.
Oh 1st Deputy Speaker Ahiafor do some TV3 reporter yawa in Parliament 
pic.twitter.com/UuDFCibXRY
 Austine Woode (@obiMpenaAustine)
December 9, 2025
AM
Also, watch below Amnesty International's 'Protect the Protest' documentary as the world marks International Human Rights Day 2025",,Politics, 10 December 2025,https://www.ghanaweb.com/GhanaHomePage/politics/Don-t-put-a-microphone-in-my-mouth-and-call-me-honourable-Ahiafor-chides-Journalist-2012981
Adwoa Safo rallies Dome-Kwabenya delegates in support of Dr Mahamudu Bawumia,"Former Member of Parliament for Dome-Kwabenya,
Sarah Adwoa Safo
, is expected to address the entire constituency on Sunday, December 14, 2025, in a crucial meeting that brings together all delegates eligible to vote in the
New Patriotic Party
s (NPP) upcoming internal presidential primaries for the 2028 general election.
The three-term MP who remains one of the constituencys most influential political figures is poised to use the gathering to energise grassroots support and consolidate votes for her preferred candidate,
Dr Mahamudu Bawumia
.
Speaking exclusively to GhanaWeb, Safo underscored the importance of consistency in politics, insisting the NPP has every reason to stick with Dr Bawumia.
Dr Bawumia is now a household name in every nook and cranny of Ghana. Hes well marketed, a popular face that even a toddler can identify with, so why should we bother ourselves going for a candidate who is yet to be marketed? she said.
She added that Dr Bawumias temperament and leadership qualities make him the natural choice for the partys future.
He has demonstrated character, emotional intelligence and the velvet to accommodate all manner of opinions, she emphasised.
Safo further highlighted the Vice Presidents transformational impact on Ghanas digital landscape.
Dr Bawumias touch in leading the digitisation revolution is what has opened Ghana to the rest of the world, making many processes seamless, she noted.
Despite her absence from Parliament, Adwoa Safo continues to command strong loyalty among many constituents.
During her tenure, she spearheaded several development projects that significantly improved livelihoods in Dome-Kwabenya.
Many party faithful still attribute the constituencys poor performance in the 2024 elections to the decision not to retain her as parliamentary candidate.
As the NPP heads into another decisive internal contest, Adwoa Safos re-emergence is expected to re-energise the base and shape the dynamics within one of the partys largest constituencies.
#TrendingGH: Extension of IGP's contract draws praise and criticism
Watch some videos from the NPPs 2025 Constitution Amendment
The wait is over! The GhanaWeb Excellence Awards 2025 is officially launched. Let's Celebrate impact, innovation and excellence across Ghana.
Who deserves to be honoured this year?
Nominate now 
https://ghanaweb.com/ghanaexcellenceawards/nominate",,Politics,  9 December 2025,https://www.ghanaweb.com/GhanaHomePage/politics/Adwoa-Safo-rallies-Dome-Kwabenya-delegates-in-support-of-Dr-Mahamudu-Bawumia-2012958
'Fight' breaks out in Ghana's parliament,"Chaos has erupted in Ghanas
Parliament
during proceedings on Tuesday, December 9, 2025, after members of the Minority Caucus abandoned their seats and massed at the centre of the chamber.
The disturbance flared during heated exchanges over the declaration of the Kpandai parliamentary seat as vacant, a decision the Minority maintains is unlawful and procedurally flawed.
Before the confrontation, Majority Leader
Mahama Ayariga
had dismissed what he described as the Minoritys continuous and orchestrated protest, insisting he was not surprised by their attempts to obstruct parliamentary business.
The Bawku Central MP accused the Minority of deliberately derailing parliamentary work over the contested Kpandai seat, arguing that the caucus had resorted to noise-making and unruly behaviour to prevent the Speaker from delivering rulings.
However, Minority Chief Whip Frank Annoh-Dompreh countered sharply, warning that government business would continue to suffer until the Kpandai matter is resolved.
Moments after his remarks, tensions escalated.
Despite the Speakers attempts to proceed, Minority MPs intensified their protest, rising from their seats, marching into the middle of the chamber and chanting in opposition.
The sudden movement triggered a chaotic confrontation, with MPs from both sides surging toward the centre of the floor.
GhanaWeb cameras captured dramatic scenes inside the chamber as MPs in a heated face-off, papers flying through the air and the Member of
Parliament
for Assin South, John Ntim Fodjour, seen angrily yelling at a colleague.",,Politics,  9 December 2025,https://www.ghanaweb.com/GhanaHomePage/politics/Fight-breaks-out-in-Ghana-s-parliament-2012957
Fuel-on-credit is proof of Bawumia's visionary digital architecture  Dr Amoakoh,"A Deputy Spokesperson for former Vice-President
Dr Mahamudu Bawumia
, Dr Ekua Amoakoh, has hailed the newly launched Fuel Now, Pay Later initiative as concrete evidence of what she describes as Dr Bawumias visionary digital architecture that continues to transform lives even while he is out of office.
In a statement titled Building the Credit-Friendly Economy Ghana Deserves, on December 9, 2025, Dr Amoakoh argued that Ghanas transition toward a credit-driven economy is not only achievable but already unfoldingthanks to the digital foundations laid under Dr Bawumias leadership.
I have long advocated for the transformational impact a shift toward a more credit-friendly economy can have on national development, she wrote, stressing that access to credit is not just about convenience, it is about unlocking opportunity, improving the quality of life for millions and stimulating sustainable economic growth.
According to her, the former Vice-Presidents digitisation agendaparticularly the Ghana Card, the national digital address system and mobile money interoperability was intentionally designed to support a modern and inclusive economy.
These interventions, she noted, were not conceived as isolated initiatives.
They were deliberate, interconnected building blocks designed to support the modern, efficient, opportunity-driven Ghana we all aspire to build.
Dr Amoakoh said the essence of a credit-friendly economy is its ability to empower citizens by expanding their purchasing power and stimulating domestic demand.
That demand, in turn, boosts local production, fuels entrepreneurship, and strengthens the private sector, she explained, describing it as a natural cycle of economic vibrancy, far more practical and impactful than the phantom so-called 24-hour economy.
She pointed to the fuel-on-credit system introduced by Star Oil as a direct outcome of these digital structures.
Today, even while Dr Bawumia is in opposition, we are witnessing a shining example of this vision materialising in real time, she stated.
Thanks to the very digital infrastructure he championed, companies like Star Oil have been able to introduce a seamless system that allows drivers to purchase fuel on credit.
Dr Amoakoh highlighted the simplicity and efficiency of the system, quoting the step-by-step process to illustrate how digital interoperability is enabling real economic empowerment.
According to her, the process is straightforward: the driver arrives at the fuel station, an attendant verifies the drivers Ghana Card and confirms their identity through NIA Face ID, after which the system instantly runs a credit check via the myCreditScore platform.
If approved, the driver buys fuel using their MoMo wallet without paying immediately and after eight hours the drivers wallet is automatically debited.
Once repayment is completed, the system unlocks the ability for the driver to make the next purchase.
She emphasised that this entire process identity verification, credit scoring, interoperability and automated payments is made possible because the digital rails already exist. Rails that were designed, constructed, and operationalised under Dr Bawumias leadership.
Calling the system the digital economy in action, Dr Amoakoh insisted it demonstrated not future promises but present realities.
This is credit access in motion. This is empowerment made real, she declared.
Dr Amoakoh further stated that if such innovation is possible even before Dr Bawumia has the chance to implement a full credit-led national economic agenda, then a national mandate would unlock even greater transformation.
Imagine what becomes possible when this vision is given the mandate and scale it deserves. Ghana is already stepping into its future. We must now choose to accelerate it, she added.'",,Politics,  9 December 2025,https://www.ghanaweb.com/GhanaHomePage/politics/Fuel-on-credit-is-proof-of-Bawumia-s-visionary-digital-architecture-Dr-Amoakoh-2012956
Kpandai Vacant Seat: Speaker Bagbin suspends sitting amid Minority chaos,"Parliament
ary proceedings were suspended following an uproar on the floor of the House when the Minority caucus blocked Majority Leader
Mahama Ayariga
from responding to calls for the withdrawal of a letter declaring the Kpandai parliamentary seat vacant.
The disruption came after
Parliament
formally notified the
Electoral Commission
on Monday, December 8, 2025, that the seat had become vacant, in accordance with a High Court ruling ordering a rerun of the constituencys election.
The Minority, dressed in black, chanted patriotic songs, banged tables, and hooted at the Clerk of
Parliament
, Ebenezer Ahumah Djietror, who had earlier tried to restore order.
Minority demands immediate withdrawal of letter to EC declaring Kpandai seat vacant
The controversy stems from a letter dated December 4, 2025, from the Clerk to
Electoral Commission
Chairperson Jean Mensa, informing her of the vacancy.
Speaking on the floor of
Parliament
, the Minority Chief Whip, Frank Annoh Dompreh, described the letter as out of place and unfortunate, arguing that it violated the rule of law and insisting that it be withdrawn.
""We strongly submit that the letter filed with the
Electoral Commission
was out of place, was unfortunate, and flies in the face of law and procedural justice. That letter must be withdrawn forthwith... Ghana is a fledgling democracy, and the least we can do is to support the procedure,"" he stated.
Kpandai chiefs urges President Mahama to intervene in election rerun dispute
Tensions heightened as the Minority repeatedly prevented
Mahama Ayariga
from speaking, prompting Speaker Alban Bagbin to suspend proceedings temporarily.
JKB/MA
Former President Kufuor shares how he became a Catholic and a Freemason",,Politics,  9 December 2025,https://www.ghanaweb.com/GhanaHomePage/politics/Kpandai-Vacant-Seat-Speaker-Bagbin-suspends-sitting-amid-Minority-chaos-2012951
