title,content,author,category,published_date,page_url
"Four soldiers, 2 'National Security' officers arrested over violent chieftaincy clash","The Kasoa Ofaakor Circuit Court on Monday, November 3, 2025, remanded two individuals claiming to be National Security officers into police custody, while four soldiers were handed over to the Military Police following violent disturbances linked to a disputed chieftaincy installation at Awutu Kwashie Abbey in the Awutu Senya West District of the Central Region.
According to an adomonline.com report on November 3, 2025, the six officers: four from the military and two claiming National Security affiliation, were arrested by the Bawjiase District Police Command after attempting to install a new chief in a community that already has a recognised traditional leader.
The suspects were apprehended during a heated confrontation between rival factions, which threatened to disrupt public order in the area.
Warehouse keeper in court over stolen Turkish doors
Police intervention prevented further escalation and restored calm to the community.
Following court proceedings, the leader of the Kasoa Asafo group, Asafo Supi Nipa Nka, expressed disappointment that the military personnel were not presented before the court alongside their civilian counterparts.
He urged the Ghana Armed Forces to uphold discipline and accountability among its ranks.
If this continues, the military will lose the respect it commands in this country, he said.
The soldiers handed over to the Military Police have been identified as Sergeant Henry Mensah, Lance Corporal Randy Nsiah, Sergeant Joseph Akaasinab, and Corporal Henry Anglow.
2 immigration officers hospitalised after armed ambush in Tempane
Despite his concerns, Asafo Supi Nipa Nka commended the Bawjiase District Police Command for their swift and professional response in containing the situation and maintaining peace in the Kwashie Abbey community.
We are grateful to the police for the professionalism and effort they showed in maintaining peace, he added, the report said.
MRA/AE
Watch as police rescue 9 soldiers allegedly attacked by angry Ahafo Hwidiem youth:",,Crime,  3 November 2025,https://www.ghanaweb.com/GhanaHomePage/crime/Four-soldiers-2-National-Security-officers-arrested-over-violent-chieftaincy-clash-2007907
2 immigration officers hospitalised after armed ambush in Tempane,"Two officers of the Ghana Immigration Service (GIS) were ambushed and shot by unidentified gunmen on Sunday, November 2, 2025, at Nagani in the Tempane District of the Upper East Region.
According to a report by myjoyonline.com, the incident occurred when the officers, who were returning from night duty on a motorbike, were attacked by the assailants.
An eyewitness recounted, ""The attackers laid an ambush and shot at the unsuspecting officers.
The report further noted that both officers sustained severe gunshot wounds, and they were rushed to the Upper East Regional Hospital in Bolgatanga, where they are receiving emergency treatment.
The latest attack occurred less than a month after a similar incident at Gbintiri, where armed men opened fire on two GIS officers stationed at an inland checkpoint.
Watch as gunmen engage in shootout at Celebrity Golf Club
During that assault, Assistant Immigration Control Officer II (AICO II) Rafiq Mohammed was killed instantly, while his colleague, AICO II Oppong Daniel, sustained critical injuries and remains under medical care.
Investigators later retrieved an AK-47 shell and a service rifle from the scene.
Meanwhile, the Ghana Immigration Service is yet to issue an official statement; preliminary reports indicate that a formal investigation has commenced to apprehend the perpetrators.",,Crime,  3 November 2025,https://www.ghanaweb.com/GhanaHomePage/crime/2-immigration-officers-hospitalised-after-armed-ambush-in-Tempane-2007880
Tricycle rider reportedly sets family of 6 on fire before hanging himself,"A tricycle rider identified as Yaw Afriyie, popularly known as Batman, has reportedly set his wife and six children on fire before taking his own life at Breman-Dunkwa in the Central Region.
Details of the tragic incident was shared on the X page of Ghana Chronicles on Sunday, November 2, 2025.
Fire contained after blaze guts Kwapong Nursing Training College dormitory
""A tricycle rider, Yaw Afriyie AKA Batman has killed his wife and six children after setting them ablaze at Breman-Dunkwa in the Central Region,"" the post read.
According to the post, the incident that occurred around midnight on October 31, 2025, is said to have followed a misunderstanding between the couple.
Moments after his wife entered the room, he is reported to have poured petrol on his wife, their children, and a grandchild, locked the door, and set them ablaze.
All seven victims were reportedly burnt to death.
""At around 12 AM on October 31, 2025, the tricycle rider is reported to have asked his wife to check up on their children, who were asleep.
""After she entered the room, he is alleged to have poured petrol on his wife and the children, including his grandchild, locked the door and lit them up in flames,"" the post said.
The tricycle rider, after committing the horrific act, reportedly also took his own life by hanging.
Sharp rise in fire injuries and deaths in first half of 2025 by 33%  GNFS
""Afriyie reportedly committed suicide by hanging himself after the act,"" the post added.
The Ghana Poloice Service is yet to officially comment on the matter.
See the post below:
A tricycle rider, Yaw Afriyie AKA Batman has killed his wife and six children after setting them ablaze at Breman-Dunkwa in the Central Region.
According to reports, Afriyie is alleged to have committed the act following a misunderstanding with his wife.
At around 12am on...
pic.twitter.com/OLGEKUhNYK
 Ghana Chronicles (@_GhChronicles)
November 2, 2025
JKB/AE
All you need to know about Ghana's new vehicle number plates | BizTech:",,Crime,  3 November 2025,https://www.ghanaweb.com/GhanaHomePage/crime/Tricycle-rider-reportedly-sets-family-of-6-on-fire-before-hanging-himself-2007872
Warehouse keeper in court over stolen Turkish doors,"A warehouse keeper accused of stealing 66 assorted Turkish doors valued at GH398,700, belonging to his employer, has appeared in court.
Emmanuel Asamoah, charged with stealing, has pleaded not guilty before an Accra Circuit Court, presided over by Susana Eduful.
The court has admitted Asamoah to bail in the sum of GH100,000 with two sureties.
The sureties, the court said, must all be public servants earning not less than GH3,000.
The prosecution, led by Chief Inspector Ebenezer Teye-Okuffo, was ordered to file disclosures per the practice direction not later than December 1, 2025.
Prosecution said the complainant was the Director of SMS Properties Ghana, residing at Spintex in Accra.
Asamoah was the Warehouse Keeper at Cambodia, Baatsona outlet of the company.
Prosecution said somewhere in 2023, Asamoah was entrusted with a variety of Turkish doors at their warehouse for collection to the companys showroom on demand.
On August 26, 2025, the complainant and one Dennis Dagadu, a witness in this case, took routine inventory of the doors and realised that the 66 doors were stolen.
They comprise 24 pieces of one-and-half doors, 39 internal doors, and three double external doors; all valued at GH398,700.
Prosecution said the complainant questioned the accused but he could not give any tangible reason.
They made a report to the police at Baatsonaa and Asamoah was subsequently arrested to assist in investigation.
During investigation, one Prince Dadzie, an apprentice of Asamoah, was also arrested, and he said Asamoah had sold some of the doors to some individuals and collected monies alleging that the complainant instructed him to do so.
However, it was revealed that Prince Dadzie was not in control of the warehouse but worked under the supervision of the accused.
Further investigation established that the accused had informed Isaac Osei Darko, a witness in this case, that he was the salesperson of the company and was authorised by his boss to sell the doors on credit and receive payment in installment.
Based on that, Asamoah sold 25 pieces of the doors to the said witness and received payments in his personal bank and Momo accounts, which he did not disclose to the complainant.
Investigations established that the accused stole and sold the remaining 42 pieces of the doors to other individuals.
The accused refunded GH20,000 out of the total value of the stolen property, while investigations were ongoing.",,Crime,  2 November 2025,https://www.ghanaweb.com/GhanaHomePage/crime/Warehouse-keeper-in-court-over-stolen-Turkish-doors-2007672
Couple arraigned over alleged rent fraud,"An Accra Circuit Court has arraigned a couple for allegedly defrauding a public servant of GH36,000 under the pretext of renting out an apartment.
Salomey Vedomey, a trader, and Nana Obeng Tandoh, a businessman, are accused of collecting the amount on July 7, 2025, claiming to rent out their chamber and hall apartment at Dzorwulu, Accra.
They have been charged with conspiracy to commit crime and defrauding by false pretences.
Both pleaded not guilty before the court presided over by Susana Eduful.
The court granted each accused person bail in the sum of GH50,000 with two sureties, to be justified with title deed documents deposited at the court registry.
The prosecution was directed to file disclosures, and the case was adjourned to December 2, 2025, for the Case Management Conference.
The complainant, a public servant residing in Dansoman, sought accommodation through an agent who introduced her to Salomey at the Dzorwulu apartment.
Salomey claimed ownership of the apartment with her husband and offered it for rent at GH1,500 per month, requesting a two-year advance.
She assured the complainant that minor works would be completed within two weeks.
On July 7, 2025, the complainant and her father met the couple at the apartment, where Salomey introduced Tandoh as her husband; both sat in the complainants car, received GH36,000, and issued a receipt signed by Tandoh.
Two weeks later, Salomey allegedly gave excuses and later claimed Tandoh had absconded with the money.
A police report was subsequently filed, leading to their arrest.
While Salomey denied the offence, Tandoh admitted it.
Investigations revealed that the couple had collected money from multiple individuals for the same apartment.",,Crime,  2 November 2025,https://www.ghanaweb.com/GhanaHomePage/crime/Couple-arraigned-over-alleged-rent-fraud-2007671
NIB arrests suspect behind fake Ghana Scholarship Secretariat accounts,"The National Intelligence Bureau (NIB) has arrested Emmanuel Ofori, the prime suspect behind a series of fraudulent social media accounts impersonating the Ghana Scholarship Secretariat.
According to official sources, Ofori allegedly created multiple fake profiles across various platforms, which he used to deceive unsuspecting individuals into making payments under the guise of securing scholarship offers.
His arrest follows weeks of investigation into complaints lodged by victims who were misled by the fraudulent accounts.
A post on X (formerly Twitter) confirmed the development, stating, Suspect behind multiple fake social media accounts impersonating the Ghana Scholarship Secretariat, Emmanuel Ofori, arrested by the National Intelligence Bureau (NIB).
In response, the Ghana Scholarship Secretariat has issued a public advisory urging anyone who may have fallen victim to the scam or made payments to the fake accounts to report the incident immediately and provide supporting evidence.
The Secretariat advises all individuals who may have fallen victim to such scams or made any form of payment to the said fake accounts to report immediately with supporting evidence, the statement read.
Victims are encouraged to contact the Secretariat through the following channels:
Hotlines: 0302 907 051 / 0302 907 058
Email: report@scholarships.gov.gh
The Secretariat reaffirmed its commitment to transparency and cautioned the public to verify all communications through its official platforms.
Investigations are ongoing, and authorities have assured the public that further updates will be provided as the case develops.
Suspect behind multiple fake social media accounts impersonating the Ghana Scholarship Secretariat, Emmanuel Ofori arrested by National Intelligence Bureau (NIB)
The Secretariat advises all individuals who may have fallen victim to such scams or made any form of payment to the...
pic.twitter.com/rsw1PpUZAH
 Ghana Scholarship Secretariat (@ScholsecGH)
October 31, 2025
VKB/MA
Watch CCTV footage of alleged soldier assaulting two civilians inside a pharmacy",,Crime,  1 November 2025,https://www.ghanaweb.com/GhanaHomePage/crime/NIB-arrests-suspect-behind-fake-Ghana-Scholarship-Secretariat-accounts-2007635
Police arrest two over murder and robbery at Aduman,"The Ashanti North Regional Police Command says it has arrested two men in connection with a robbery and murder at Aduman in the Kodie Municipality.
According to the Police, the suspects, Sani Abacha, 28, and Asante Eric, 23, attacked two young men and stole a tricycle, popularly known as Aboboyaa, on Sunday, October 19, 2025.
They explained that Abacha lured the victims, 18-year-old Kwabena Yankyira and 15-year-old Kwabena Boateng, under the pretence of using the tricycle to carry firewood from his farm. After leading them into a bush, he attacked both with a cutlass, leaving them with several wounds before fleeing with the tricycle.
Police said Abacha later contacted his accomplice, Eric, and together they hid the tricycle at the Aboabogya Cemetery.
They later sold it to another man, identified only as Balawe, who is now on the run.
The Police said that the next morning, a resident found Kwabena Yankyira unconscious in a cocoa farm near the Aduman Old Town Cemetery, with deep cutlass wounds to his neck, head, and ear.
He was rushed to St. Patricks Hospital at Maase-Offinso for treatment. Sadly, the body of the second victim, Kwabena Boateng, was later found nearby with similar injuries.
They said officers who visited the scene recovered a cutlass believed to have been used in the attack and took the deceaseds body to St. Patricks Hospital for preservation and autopsy.
According to them, after an intelligence-led operation, they arrested Sani Abacha on October 24, 2025, at Asafo Tinkamu.
He later led the team to arrest his accomplice, Asante Eric, at Aboabogya. Both have reportedly confessed to committing the crime.
They added that the suspects were arraigned before the Kodie Magistrate Court on October 28, 2025, on provisional charges of robbery and murder. They have been remanded into prison custody to reappear on November 25, 2025.
The Command said they are still working to arrest the third suspect and recover the stolen tricycle.
They assured the public that they remain committed to fighting violent crime and urged anyone with information that could lead to the arrest of the remaining suspect to contact the nearest Police station or call 191, 18555, or 112.",,Crime,  1 November 2025,https://www.ghanaweb.com/GhanaHomePage/crime/Police-arrest-two-over-murder-and-robbery-at-Aduman-2007588
Police rearrest guardian over alleged abuse of seven-year-old girl,"The Nima Division of the Domestic Violence and Victims Support Unit (DOVVSU) in Accra has rearrested 24-year-old Ayisha Zakaria for allegedly abusing a seven-year-old girl by burning her private parts.
Zakaria had initially been released less than 48 hours prior after the complainant, Sarki Musah Umar, withdrew the case due to family and community pressure and financial constraints.
The rearrest followed public outrage after videos of the abuse were circulated online.
It is alleged that Zakaria used a heated spoon to punish the child for bedwetting, resulting in injuries that prompted school authorities to intervene.
Imam Abdul Razak Iddriss of the Hamburg Mosque has called for nationwide justice and criticised local authorities for their failure to protect the victim.
Community members have raised GH2,000 for the child's medical care at Korle Bu Teaching Hospital.",,Crime, 31 October 2025,https://www.ghanaweb.com/GhanaHomePage/crime/Police-rearrest-guardian-over-alleged-abuse-of-seven-year-old-girl-2007557
Case of guardian burning child over bedwetting reportedly withdrawn,"A 24-year-old guardian, Ayisha Zakaria, has been arrested for allegedly inflicting burns on the private parts and inner thighs of a seven-year-old girl as punishment for bedwetting.
Eyewitnesses said the incident occurred at Mamobi in the Ayawaso North Municipality when the suspect allegedly heated a metal object, believed to be a spoon, and applied it to the victims body.
The injuries reportedly caught the attention of school authorities, who followed up on the matter, which had initially been kept secret.
Stepmother allegedly scalds toddler for bedwetting
According to a GHOne News post on X on October 30, 2025, the case was reported to the Nima Division of the Domestic Violence and Victims Support Unit (DOVVSU), leading to the suspects arrest last Thursday after community members raised concerns.
However, the complainant, Sarki Musah Umar, a youth leader in the area, is said to have withdrawn the case on Monday, citing pressure from the victims family and community leaders.
Financially, I was incapable because I was the only one spending money, from going to the hospital to the police station, he explained.
During a lecture at the Hamburg Mosque in Mamobi on Monday, Imam Abdul Razak Iddriss called on well-meaning Ghanaians to demand justice for the child.
He criticised both the police and community leaders for failing to protect the victim, saying, No matter how poor you are, it is better to have your children closer to you and cater for them. Only a few children who grow up with guardians excel in life.
Mother burns 11-year-old son on chest, belly as punishment for losing pen
The Imam disclosed that GH2,000 had been raised to support the victims medical treatment at the Korle Bu Teaching Hospital.
When contacted, officials at the Nima Division of DOVVSU confirmed that the case had been withdrawn but said they were monitoring the situation to ensure the childs welfare.
MRA/AE
NPPs KOKA speaks on NDC government's performance in 10 months",,Crime, 30 October 2025,https://www.ghanaweb.com/GhanaHomePage/crime/Case-of-guardian-burning-child-over-bedwetting-reportedly-withdrawn-2007390
"Scholarship Secretariat, NIB arrest fraudster behind fake scholarship scheme","The Ghana Scholarship Secretariat, in collaboration with the National Investigations Bureau (NIB), has arrested one Emmanuel Ofori, an alleged fraudster accused of swindling unsuspecting Ghanaians of millions of cedis under the guise of offering them government scholarships.
According to information available to Purefmonlinegh.com, the suspect operated several fake social media accounts, including Facebook, LinkedIn, and Instagram, impersonating the Scholarship Secretariat. Through these fraudulent platforms, he allegedly lured victims with promises of scholarship awards, extorted money from them, and issued fake scholarship certificates bearing forged signatures of the Registrar.
The NIB arrested the suspect in Tema after an intelligence-led operation triggered by a formal complaint from the Registrar of the Secretariat, Alex Kwaku Asafo-Agyei, who sought the Bureaus assistance to clamp down on the longstanding scam.
I urge the public, especially prospective applicants, to remain vigilant and rely only on the Secretariats official communication channels, the Registrar cautioned. Be wary of individuals or platforms that promise scholarships in exchange for money.
Reliable sources have confirmed that the suspect will be arraigned before the court on Monday, November 3, 2025.
When contacted, Asafo-Agyei confirmed the arrest, commending the NIB for its swift action and urging the public to assist in the ongoing investigation.
We encourage anyone who may have fallen victim to this fraudulent scheme to contact the Secretariat through 0302907058/0302907051 to submit any hard evidence that could aid prosecution, he said.
The Ghana Scholarship Secretariat, established to provide financial support to brilliant but needy students and to reward academic excellence on a merit-based system, has repeatedly cautioned the public that its scholarship awards are not for sale. The Secretariat awards both local and foreign scholarships strictly through transparent and verifiable procedures.",,Crime, 30 October 2025,https://www.ghanaweb.com/GhanaHomePage/crime/Scholarship-Secretariat-NIB-arrest-fraudster-behind-fake-scholarship-scheme-2007356
"Senior pastor, two others held over alleged ritual activities, kidnapping","Police have arrested the Senior Pastor of Graceland Sanctuary, Major Wisdom Nutsugah and two junior pastors over alleged ritualistic activities at Buduburam in the Gomoa East District of the Central Region.
According to reports, the Senior Pastor, together with his two junior pastors, allegedly kidnapped six okada riders from Buduburam after inviting them to his residence for a meeting.
Preliminary information indicates that the pastor had earlier purchased motorbikes for the riders and accused them of poor sales, prompting the invitation.
However, the victims claim that upon arrival, they were locked in a dark room, threatened and forced to undress.
The pastor allegedly instructed one of his junior pastors to bring out a strange pot containing toffees from a secret room.
The victims allege that they were forced to consume the toffees and were threatened with harm if they disobeyed his orders.
One of the victims reportedly managed to escape and alerted the police, who later rescued the remaining victims and arrested the pastor along with his two assistants.
The suspects are currently in police custody at the Kasoa Divisional Police Command, assisting with investigations.
Meanwhile, the Assembly Member for the Buduburam Electoral Area, Emmanuel Dogbe, has condemned the incident and urged the police to conduct a thorough investigation and ensure appropriate action is taken if the suspects are found guilty.",,Crime, 30 October 2025,https://www.ghanaweb.com/GhanaHomePage/crime/Senior-pastor-two-others-held-over-alleged-ritual-activities-kidnapping-2007274
Police interdict officers over bribery video,"The Bono Regional Police Command has interdicted a number of officers following the circulation of a video on social media allegedly showing some personnel accepting money from motorists.
In a statement dated October 29, 2025, and signed by Chief Inspector Thomas Akeelah, Public Relations Officer, for the Bono Region said the officers involved have been identified and placed on interdiction to allow for a thorough and impartial investigation into the matter.
Man arrested for impersonating police officer at Black Star Square
The Bono Regional Police Command has initiated an investigation into a video circulating on social media that shows some police officers allegedly taking money from motorists.
""The officers involved have been identified and interdicted to allow for a thorough and impartial investigation into the incident"", it noted.
The Command urged members of the public to report any incidents of misconduct to ensure swift action is taken against erring officers.
Obuasi Police arrest 32-year-old suspect in Kwabenakwa gun attack incident
""The Command assures the public of its commitment to upholding the highest standards of professionalism and accountability among its personnel"", it added.
See the full statement below:
JKB/AM
Short hair won't stop double-salary scandals'  Ras Mubarak fires back at Haruna Iddrisu",,Crime, 29 October 2025,https://www.ghanaweb.com/GhanaHomePage/crime/Police-interdict-officers-over-bribery-video-2007264
49-year-old fisherman jailed 10 years for defilement,"The Circuit Court Two in Cape Coast has sentenced Samuel Armah, also known as Kofi Nyan, to ten years imprisonment with hard labour for defilement.
According to a statement issued by the Central Regional Police Command on October 29, 2025, the incident occurred on October 16, 2025, at Mumford, where the accused reportedly lured the victim into a ghetto and sexually assaulted her.
GES removes assistant headmaster over 'dirty' viral video scandal
The defilement case involving the accused person, Samuel Armah alias Kofi Nyan, which occurred on October 16, 2025, was called at Circuit Court Two, Cape Coast, presided over by Her Honour Nana Aba Quiba Nunoo. The accused person pleaded guilty to the charge and was sentenced to ten (10) years imprisonment in hard labour, the statement said.
Headmaster in hot waters for allegedly impregnating final year JHS student
The accused person was sentenced on his own plea.
""The accused person pleaded guilty to the charge of defilement, and he was convicted on his own plea and sentenced to serve ten (10) years imprisonment in hard labour,"" it added.
Read the full statement below:
PRESS RELEASE:
POLICE UPDATE ON APAM DEFILEMENT CASE: SAMUEL ARMAH (KOFI NYAN) SENTENCED TO 10 YEARS IMPRISONMENT FOR DEFILEMENT
pic.twitter.com/9MJp3n6U9r
 Ghana Police Service (@GhPoliceService)
October 29, 2025
JKB/AE
Short hair won't stop double-salary scandals'  Ras Mubarak fires back at Haruna Iddrisu",,Crime, 29 October 2025,https://www.ghanaweb.com/GhanaHomePage/crime/49-year-old-fisherman-jailed-10-years-for-defilement-2007231
