title,content,author,category,published_date,page_url
Ransford Owusu Ansah's Death: Facts emerging about coach Ibrahim Anyass,"Until recently, Ibrahim Anyass was known simply as a youth football coach helping young boys chase their dreams at the Siano Football Academy in Amasaman, Accra.
Today, he stands accused of shattering those very dreams, allegedly preying on one of his players, 16-year-old Ransford Owusu Ansah, whose death in March 2025 sparked nationwide outrage.
Very little is publicly known about Anyass, the man at the centre of one of Ghanas most disturbing football scandals. Anyass, believed to be in his late thirties, is the head coach of Siano Football Academy.
This small community-based setup drew dozens of young boys with dreams of becoming professional footballers.
10 Ghanaian-born players who have switched to play for other countries
For many parents, Siano was seen as a chance to give their children a future through football.
But behind the hopeful smiles and training sessions, disturbing allegations have emerged that Anyass sexually abused some of the boys under his care, including 16-year-old Ransford Owusu Ansah, who tragically died in March 2025 after reportedly enduring years of abuse.
While Anyass kept a relatively low public profile, a few videos circulating online show him in casual moments with the children, sometimes in rooms where they appear to be asleep, or on the training grounds where he led practice drills.
These clips, once harmless to viewers, have now taken on a chilling new context as investigators and the public question what really went on behind closed doors at the academy.
Anyass has yet to publicly respond to the allegations. The closest he came was during a reported phone call on a television programme, where he promised to share his side of the story, a promise he never fulfilled.
He has, however, been summoned by the Criminal Investigation Department (CID) to respond to the accusations following widespread outrage and a growing online campaign under the hashtag #JusticeForRansford.
Allegedly this is the face of the Coach Ibrahim who d Ransford to his death. And he Dey camp other kiddies too dem for arrest am cus I feel hes not done.
#JusticeForRansford
pic.twitter.com/VwFLnWzRLg
 Bofrot1cedi (@bofrot1cedi)
November 7, 2025
If you dont know Coach Ibrahim, this is how he looks and the little boys you see are also boys with dreams of being footballers just like Ransford
https://t.co/Iy3qgUBmjH
pic.twitter.com/iTLkiqKR5E
 Nana Adjoa Asantewaa Adjei (@thisisnanaadjoa)
November 6, 2025
FKA/JE
Meanwhile, watch the latest edition of Sports Check with Godwin Sackey in the post below",,Crime,  7 November 2025,https://www.ghanaweb.com/GhanaHomePage/crime/Ransford-Owusu-Ansah-s-Death-Facts-emerging-about-coach-Ibrahim-Anyass-2008521
November 20 set for hearing in malicious prosecution case against police officers,"A motion on notice has been filed to set down for hearing the case involving two
Ghana Police Service
officers accused of malicious prosecution by the leader of the Alliance for the Restoration of Civil Rights (ARCR), William Kofi Yirenkyi.
The case has been scheduled for hearing on November 20, 2025, at the Accra High Court (General Jurisdiction).
In a Facebook post dated November 5, 2025, Yirenkyi disclosed that the
Ghana Police Service
had failed to file a defence or enter an appearance in the civil suit, nearly three months after being served.
Describing the silence as a disregard for due process, he said he had instructed his lawyers to proceed by filing a motion on notice to set the case down for hearing.
He cited the Supreme Court decision in In Re Nungua Chieftaincy Affairs, Nii Odai Ayiku IV v. Attorney-General and Wor-Nii Bortei Bortelabi [2010] SCGLR 413, which allows for such motions when defendants fail to respond within the required time frame.
The landmark malicious prosecution suit was originally filed on May 26, 2025, at the High Court of Justice in Accra.
The defendants, Detective Corporal (D/C) Inspector Mathias Awudi and D/C Inspector Richard Ackumey, both attached to the Accra Regional Police Command, are accused of wrongful arrest, unlawful detention and initiating a baseless prosecution against Yirenkyi.
According to court documents, the dispute stems from December 30, 2023, when Yirenkyi reported an assault case at the Cantonments Police Station.
Dissatisfied with the pace of investigations, he escalated the matter to the Greater Accra Regional Police Commander in January 2024, leading to its reassignment to D/C Inspector Awudi.
However, after nearly eleven months of what Yirenkyi described as no tangible progress, tensions escalated on November 13, 2024, when he inquired about the case status.
He alleges that Awudi reacted angrily and had him arrested and detained for three days without cause.
William Yirenkyi drags two police officers to court over alleged malicious prosecution
Two days later, on November 15, 2024, he was arraigned before the Gbese District Court on charges of disturbing the peace in a public place under Section 298 of the Criminal Offences Act, 1960 (Act 29).
The prosecution, led by D/C Inspector Ackumey, reportedly failed to provide credible evidence, leading to Yirenkyis discharge by the court for lack of reasonable and probable cause.
Yirenkyi contends that the officers actions were driven by personal vendetta and intended to retaliate against his persistence in seeking justice.
He is seeking, A declaration of malicious prosecution, Special damages totaling GH40,000, covering legal fees (GH20,000) and lost income during detention, General damages, Costs and any further relief deemed appropriate by the court.
The writ of summons was issued by his lawyer, Martin L. Kpebu of Black Star Legal Services and served on the defendants with a directive to respond within eight days or risk judgment by default at the time.
The case will be heard on November 20, 2025, at the Accra High Court (General Jurisdiction).
AM
Watch the promo to GhanaWeb's latest documentary, which uncovers the evolution of kayamata,' an exploitative practice fueled by love charms and manipulation, titled, The Dark Side of Kayamata,' below:
The wait is over! The GhanaWeb Excellence Awards 2025 is officially launched. Let's Celebrate impact, innovation and excellence across Ghana.
Who deserves to be honoured this year?
Nominate now 
https://ghanaweb.com/ghanaexcellenceawards/nominate",,Crime,  7 November 2025,https://www.ghanaweb.com/GhanaHomePage/crime/November-20-set-for-hearing-in-malicious-prosecution-case-against-police-officers-2008470
Man gets 16 years imprisonment for sodomising seven year old boy,"A Cape Coast Circuit Court two on Thursday, jailed Eric Asamoah, 22- year old man to 16 years imprisonment in hard labour for defiling a seven year old boy at Mankessim.
Asamoah pleaded guilty to the charge of defilement and was sentenced accordingly by the court presided over by Mrs Nana Aba Quaiba Nunoo.
Prosecuting Chief Inspector Simon Sartey told the court that Asamoah stays at Nananom, a surburb of Mankessim in the Mfantseman Municipality same as the victim.
He said the victim fell sick and confided in his father about his ordeal in the hands of Asamoah.
The Prosecutor stated that Asamoah severally defiled the boy on countless occasions whenever the area was quiet.
The victim who fell sick and was sent to the Saltpond Municipal Hospital, has been on admission for days and is responding to treatment.
On Monday November 03, the police with assistance of the victims father tracked and arrested Asamoah.",,Crime,  7 November 2025,https://www.ghanaweb.com/GhanaHomePage/crime/Man-gets-16-years-imprisonment-for-sodomising-seven-year-old-boy-2008441
2024 Kasoa Shooting: Ive been vindicated by Interior Ministers report  Hawa Koomson,"Former Member of Parliament for Awutu Senya East,
Mavis Hawa Koomson
, says she feels vindicated by the report of the Minister for the Interior, Muntaka Mohammed Mubarak, on the 2024 Kasoa shooting incident, which attributed the violence to security lapses and institutional failures rather than any individuals actions.
In a statement on Thursday, November 6, 2025, Hawa Koomson said the findings confirm what she had always maintained  that she was wrongly accused and unfairly targeted by the public and sections of the media.
The Ministers report confirms that 21 suspects have been identified, that there were clear breaches of discipline by some security officers, and that the use of firearms in certain situations was unjustified, she stated.
These findings affirm what I have consistently maintained, that the Kasoa incident was the result of security lapses and institutional failures, not the actions or instigation of any individual.
She lamented the years of vilification and what she described as harsh and unfair public attacks that branded her violent and unfit for office.
For years, I endured harsh and unfair public attacks. I was branded violent, reckless, and unfit for office through sensational and misleading headlines. The judgment was swift and painful. Today, the Interior Ministers findings have vindicated me, she said.
The former minister also recalled being assaulted during the rerun of polling stations in Ablekuma North, an incident she described as one of the darkest moments of her public life.
Hawa Koomson expressed sympathy for victims of electoral violence and endorsed the Interior Ministers recommendations for reforms in election security management.
She appealed to the public and political actors to avoid misinformation and divisive rhetoric, calling instead for unity and reflection.
Let us avoid misinformation, incitement, and divisive rhetoric. This moment calls not for blame, but for introspection, justice and national unity, she urged.",,Crime,  7 November 2025,https://www.ghanaweb.com/GhanaHomePage/crime/2024-Kasoa-Shooting-I-ve-been-vindicated-by-Interior-Minister-s-report-Hawa-Koomson-2008437
Man sets family ablaze at Akyempim,"Tragedy struck at Akyempim in the Upper Denkyira East Municipality of the Central Region when a man allegedly set his family on fire, killing his wife and six children in the early hours of Saturday.
A statement issued by the Central Regional Public Relations Officer of the Ghana National Fire Service (GNFS), DO II Abdul Wasiu Hudu, said the Dunkwa-On-Offin Fire Station received a distress call around 1:04 a.m. and quickly dispatched a rescue team to the scene, located at digital address AA-F5259-7534.
Preliminary investigations revealed that the husband of the deceased woman allegedly set the bedroom on fire while his family was asleep and locked the door from outside before fleeing.
He was later found dead in a nearby bush, having reportedly hanged himself.
When firefighters arrived at 1:20 a.m., one of the bedrooms was already completely engulfed in flames with a padlock on the door.
The team managed to contain the fire by 1:32 a.m., preventing it from spreading to other rooms.
According to the GNFS, the victims included five children aged between one and 15 years, their mother, and her eldest daughter.
Their charred remains have been handed over to the police for further investigation.
The GNFS extended its condolences to the bereaved family and urged the public to remain fire-safety conscious, calling on citizens to immediately contact emergency numbers (112 / 0201500360 / 0302772446) in case of fire outbreaks.",,Crime,  6 November 2025,https://www.ghanaweb.com/GhanaHomePage/crime/Man-sets-family-ablaze-at-Akyempim-2008366
GCB Bank contract staff in court over theft,"A 29-year-old electronic collector has been arraigned before an Accra Circuit Court for allegedly stealing GH490,400 belonging to GCB Bank.
Samuel Owusu, a contract staff of the bank, has been charged with stealing and has pleaded not guilty.
The prosecution, led by Inspector Priscilla Avorgah, told the court that the complainant is the Manager of Security and Fraud Investigation at GCB Bank Plc, while Owusu was stationed at the banks Abossey Okai branch in Accra.
Inspector Avorgah said Owusu, was responsible for collecting money from customers and depositing it into their respective accounts using a dedicated phone assigned to him.
She said a preliminary audit conducted on October 29, 2025, revealed that GH490,400 had been stolen from several customer accounts.
The court heard that Owusu was confronted by the complainant, the bank manager, and his supervisor, during which he admitted stealing the money between February and October 2025.
According to the prosecution, Owusu claimed he invested the stolen funds in an online trading platform known as qadatralife.com in hopes of making a profit.  He was subsequently arrested and taken to the police station to assist with investigations.
In his caution statement, Owusu stated that he did not steal the entire amount at once but appropriated the funds gradually by failing to deposit monies collected from customers into their accounts.",,Crime,  6 November 2025,https://www.ghanaweb.com/GhanaHomePage/crime/GCB-Bank-contract-staff-in-court-over-theft-2008307
Police arrest and investigate woman in viral audio inciting violence in Garu,"The Upper East Regional Police Command has arrested a woman who was heard in a viral audio inciting violence in Garu.
The suspect identified as Lariba Alhassan was arrested on Wednesday, November 5, 2025, for allegedly inciting the people of Garu to attack and kill soldiers trying to keep the peace in Garu.
According to a police statement, signed by Chief Inspector Abdul-Rahman Sumaila, Public Relations Officer, Upper East Region, she ""also urged the youth to burn houses and attack dignitaries"".
The suspect who is in police custody will be put before the court at a yet-to-be-communicated date.
The Upper East Regional Police Command underscored their commitment to ""ensuring the peace and safety of all residents in Garu"".",,Crime,  6 November 2025,https://www.ghanaweb.com/GhanaHomePage/crime/Police-arrest-and-investigate-woman-in-viral-audio-inciting-violence-in-Garu-2008253
Fetish priest jailed 15 years for defiling and impregnating minor,"Correspondence from the Eastern Region
The Odumase-Krobo Circuit Court in the Eastern Region has sentenced a 26-year-old fetish priest, Ebenezer Asumah, to 15 years imprisonment with hard labour for defiling a 15-year-old girl at Osuwem, a community near Asutuare in the Shai-Osudoku District of the Greater Accra Region.
The Court found Asumah guilty of defilement contrary to section 101 (2) of the Criminal Offences Act 1960 (Act 29).
The Facts of the Case
Prosecuting, Chief Inspector John Kwesi Brahene disclosed that the complainant, Animo Mavis, a 27-year-old seamstress residing at Sawer-Sum near Somanya, is the elder sister of the victim.
The 15-year-old victim lived with their grandmother, Florence Ladjer, at Osuwern, where the accused also resided.
On August 5, 2025, in the evening, the accused approached the victim's grandmother and convinced her to allow the girl to accompany him to his house to assist with cooking, claiming he had injured his right hand. Out of sympathy, the grandmother obliged his request and allowed the girl to go with him.
The victim later prepared banku, pepper, and fish for the accused. After eating, Asumah locked the girl inside his room and forcibly had sexual intercourse with her.
The court heard that the act was repeated on three occasions.
Some weeks later, the victim began to feel unwell, prompting her sister to take her to the Somanya District Hospital on October 22, 2025, where she was diagnosed as pregnant.
Upon questioning, the girl identified the accused as the one responsible.
A complaint was subsequently lodged with DOVVSU Akuse, where police obtained statements from both the complainant and the victim.
A medical report form issued to the complainant was sent to the Akuse Government Hospital, where it was confirmed that the victim was 11 weeks pregnant.
The accused was arrested on October 23, 2025, and during interrogation, admitted to having sexual intercourse with the minor but claimed it was consensual.
After investigations, he was charged and arraigned before the Eastern Circuit Court at Odumase-Krobo.
Judgment
The presiding judge, His Honor Akwesi Appietse Abaidoo found the accused guilty and sentenced him to 15 years' imprisonment with hard labour, stressing that the punishment should serve as a deterrent to others who take advantage of minors.",,Crime,  5 November 2025,https://www.ghanaweb.com/GhanaHomePage/crime/Fetish-priest-jailed-15-years-for-defiling-and-impregnating-minor-2008226
Legal Aid lawyer to represent 51 foreigners in immigration case,"A Legal Aid Commission lawyer has agreed to represent 51 out of over 100 foreign nationals arraigned for alleged illegal entry and failure to acquire residence or work permits in Ghana.
Okyere Kumah, the assigned lawyer, introduced himself to the accused persons through an interpreter on Monday.
Initially, they rejected him, requesting proof of his legal status.
Kumah told the court that although the accused persons had refused to accept him, he had to announce his representation for the record.
For the sake of records, I had to announce myself and be recorded by the Court, he said.
However, Moussa Sylla, one of the accused, later explained that their hesitation stemmed from fear, as several individuals had previously claimed to be lawyers.
We did not have anything against him, just that we were scared... but we now trust him to represent us, he said.
Following this, Kumah applied for bail, but the Accra Circuit Court 11 declined, stating the request was premature.
The court ordered that the accused be remanded into prison custody, not police custody, citing the Prisons Services capacity to accommodate them.
The development occurred after the prosecution substituted its original charge sheet filed on October 21 with an amended version on November 3, 2025.
All 51 accused persons pleaded not guilty to charges of illegal entry and failure to obtain the necessary permits.
Assistant Superintendent of Police (ASP) Issah Archibari told the court that on October 7, 2025, police received intelligence about over 100 foreign nationals residing at Kuntunse-Satellite near Amasaman.
Upon arrival, the accused refused to disclose their identities and were arrested.
Investigations revealed they were from neighbouring francophone countries and had entered Ghana illegally between February and September 2025, working as Q-Net marketers without documentation.
ASP Archibari said they posed a flight risk and lacked permanent addresses.
Mr Kumah, however, argued that his clients had fixed residences and would appear for trial.",,Crime,  5 November 2025,https://www.ghanaweb.com/GhanaHomePage/crime/Legal-Aid-lawyer-to-represent-51-foreigners-in-immigration-case-2008116
Man arrested for allegedly sodomising a 7-year-old boy,"Police in Mankessim, in the Central Region, have apprehended a 22-year-old man identified as Kweku for allegedly sodomising a minor.
The information was shared on the X page of GHOne TV on Tuesday, November 4, 2025.
Police in Mankessim have arrested a 22-year-old man, identified as Kweku, for allegedly sodomising a 7-year-old boy, Calib Takyi, in the Nananom suburb, the post read.
Headmaster in hot waters for allegedly impregnating final year JHS student
It noted that,""The victims father was called while returning from church and informed that the suspect had been caught in the act. Upon arrival, Kweku reportedly admitted to the offence'.
It noted that, The victims father was called while returning from church and informed that the suspect had been caught in the act. Upon arrival, Kweku reportedly admitted to the offence.
""The child was taken to the Roman Hospital and later referred to the Cape Coast Teaching Hospital for further medical examination, it concluded.
Read the post below:
Police in Mankessim have arrested a 22-year-old man, identified as Kweku, for allegedly sodomising a 7-year-old boy, Calib Takyi, in the Nananom suburb. According to the victims father, he was called while returning from church and informed that the suspect had been caught in...
pic.twitter.com/nFOmX6phy9
 GHOne TV (@ghonetv)
November 4, 2025
JKB/MA
Meanwhile, watch below a video of the disturbing current state of Nana Konadu's Makola Clinic, which has been left to rot:",,Crime,  4 November 2025,https://www.ghanaweb.com/GhanaHomePage/crime/Man-arrested-for-allegedly-sodomising-a-7-year-old-boy-2008083
"Thieves raid NCCE, CHRAJ offices, steal computers and air conditioners","Thieves have broken into the Bibiani-Anhwiaso-Bekwai Municipal Office of the National Commission for Civic Education (NCCE) in the Western North Region.
According to a report by 3news.com, the Municipal Director of the NCCE, Martha Nneka Opara, confirmed the incident in a phone interview with TV3 on Tuesday, November 4, 2025.
Police arrest two over murder and robbery at Aduman
She said, ""The thieves also broke into other government institutions within the same premises, including the Commission on Human Rights and Administrative Justice (CHRAJ), the Audit Department, and the Electoral Commission's store, where they stole a main switch, electrical wires, service lines, and air conditioners"".
Martha Nneka further noted that the burglars also targeted other government offices located within the same premises.
22-year-old woman jailed six months for stealing provisions worth GH1,384
""The thieves also broke into other government institutions within the same premises, including the Commission on Human Rights and Administrative Justice (CHRAJ), the Audit Department, and the Electoral Commission's store, where they stole a main switch, electrical wires, service lines, and air conditioners,"" she said.
Meanwhile, the incident has been reported to the police for investigation.
JKB/SEA
Watch the promo to
GhanaWeb
's latest documentary, which uncovers the evolution of kayamata,' an exploitative practice fueled by love charms and manipulation, titled, The Dark Side of Kayamata,' below:",,Crime,  4 November 2025,https://www.ghanaweb.com/GhanaHomePage/crime/Thieves-raid-NCCE-CHRAJ-offices-steal-computers-and-air-conditioners-2008040
Scrap dealer jailed three months for stealing metals at Bomso,"A 30-year-old scrap dealer, Yakubu Zakari, has been sentenced to three months imprisonment by the Kwadaso Circuit Court for stealing metals at Bomso in Kumasi.
Zakari, who resides at Aboabo, pleaded not guilty to the charge of stealing but was found guilty after a full trial.
The case was presided over by Jephthah Appau.
Police Chief Inspector David Opoku Kwabi, presenting the facts of the case, told the court that the complainant, Obeng Abayie, a trader residing at Bomso, spotted the convict carrying a sack containing four metal bracings in front of his shop around 1420 hours on January 13, 2025.
The complainant, suspecting the metals were his, rushed home to verify and discovered that the door to his garage had been damaged and four metal bracings were missing.
He immediately pursued Zakari and caught up with him at Bomso Top High, where the convict was loading the stolen items into a tricycle.
Abayie raised an alarm, attracting the attention of nearby police officers who arrived at the scene and arrested Zakari.
A search at the Bomso Police Charge Office led to the retrieval of several items from the convict, including a frying pan, a cutlass, four metal bracings, a pinch bar, a hammer, parts of a standing fan, and four iron rods, all valued at an amount yet to be determined.
In his caution statement, Zakari denied stealing the items, claiming he had bought them from two unidentified young men at Bomso.
However, he failed to provide any proof of purchase or lead police to the alleged sellers.
After investigations, he was charged with stealing and subsequently convicted by the court.",,Crime,  4 November 2025,https://www.ghanaweb.com/GhanaHomePage/crime/Scrap-dealer-jailed-three-months-for-stealing-metals-at-Bomso-2007949
Taxi driver shot dead by suspected armed robbers at Ngleshie Amanfro,"Some unidentified individuals, suspected to be armed robbers, have allegedly killed a taxi driver at Ngleshie Amanfro in the Ga South Municipality of the Greater Accra Region.
According to a report by graphiconline.com, the incident occurred on Friday, October 31, 2025.
Upper East: 3 shot dead, 2 injured as gunmen allegedly storm Binduri township
""The driver, identified only as Kwame, was said to have been shot and killed by four armed robbers who attacked him around 5am while he was on his way to work.
""The attackers, riding two motorbikes, confronted Kwame at the Roman School area. At the time, he was walking to a nearby lorry station to pick a vehicle for his journey when the robbers demanded his bag, money, and phone. He resisted and attempted to fight them but was shot in the rib"", the report noted.
An eyewitness said the driver had stopped driving his taxi for a period and was currently working with a contractor on the Kasoa-Winneba Road project.
He reportedly underestimated the robbers, seeing them as small boys, which led him to confront them.
Another resident recounted hearing the confrontation but said people were too afraid to intervene because of the gunshots.
Gunmen kill 3, injure radio station manager at Binduri
She expressed shock at the incident, noting that it happened in the early morning when the area was busy.
Although the robbers took his belongings, she suggested that the attack might have been motivated by more than just robbery.
JKB/AM
Watch as police rescue 9 soldiers allegedly attacked by angry Ahafo Hwidiem youth:",,Crime,  3 November 2025,https://www.ghanaweb.com/GhanaHomePage/crime/Taxi-driver-shot-dead-by-suspected-armed-robbers-at-Ngleshie-Amanfro-2007938
