Page,ContentURL,Transcript
8,https://audio-bible-cdn.youversionapi.com/1184/32k/JOS/8-fa01fe8e577d0fca493fe9d0fee7bf11.mp3,"Yehowa gblɔ na Yosua be, “Mègavɔ̃ o, eye dzi megaɖe le ƒowò o. Kplɔ aʋakɔ blibo
la yi Ai, elabena ɣeyiɣi la de na mi azɔ be miaɖu Ai dzi. Metsɔ Ai fia kple eƒe
ameawo katã de asi na mi. Miatsrɔ̃ wo abe ale si mietsrɔ̃ Yeriko kple woƒe fia
ene. Ke azɔ ya la, miate ŋu atsɔ woƒe nuwo kple woƒe nyi siwo mieha la woazu mia
tɔ. Na ameawo nade xa ɖe dua godo.” Ale Yosua dzra ɖo hena aʋahoho ɖe Ai ŋu kple
eƒe aʋawɔlawo katã. Etia eƒe asrafo nyuitɔwo akpe blaetɔ̃ ɖo ɖa le zã me; egblɔ
na wo do ŋgɔ be, “Mide xa ɖe dua ƒe akpa kemɛ, migade megbe tso dua ŋu fũu o,
eye minɔ ŋudzɔ na wo dzi dzedze.” Egagblɔ na wo be, “Ne míaƒe aʋakɔ blibo la ho
aʋa ɖe Aitɔwo ŋu la, Aitɔwo ado go ava kpe mí na aʋawɔwɔ abe ale si wowɔ zi
gbãtɔ ene. Ekema míade asi sisi me, eye woakplɔ mí ɖo va se ɖe esi woƒe
aʋawɔlawo katã ado go le dua me. Woagblɔ be, ‘Israelviwo gale sisim abe ale si
wowɔ zi gbãtɔ ene!’ Ekema miado tso afi si miede xa ɖo, age ɖe dua me, elabena
Yehowa miaƒe Mawu atsɔe na mí. Mitɔ dzo dua abe ale si Yehowa ɖo na mí ene.
Esiawoe nye nye ɖoɖowo na mi.” Ale wodze mɔ zã ma me yi ɖade xa ɖe Betel kple Ai
ƒe ɣetoɖoƒe gome, le esime Yosua kple aʋawɔla bubuawo tsi asaɖa la me le Yeriko.
Esi ŋu ke ŋdi kanya la, Yosua yɔ aʋawɔlawo, eye woawo kple Israel ƒe ametsitsiwo
ɖo ta Ai. Yosua kple aʋawɔla siwo nɔ eŋu la yi ɖe dua ƒe agbo gãtɔ gbɔ, woƒu
asaɖa anyi ɖe anyiehe lɔƒo, eye balime aɖe nɔ asaɖa la kple Ai du la dome. Eɣla
ame abe akpe atɔ̃ ene ɖe dua ƒe ɣetoɖoƒe lɔƒo, le Betel kple Ai dome. Woɖo
asrafoawo ɖe aʋawɔwɔ ŋu, ame geɖewo nɔ dua ƒe anyiehe lɔƒo, eye mamlɛawo nɔ dua
ƒe ɣetoɖoƒe lɔƒo. Yosua tsi balime la le zã ma me. Ai fia kpɔ Israelviwo ɖa le
balime la godo, eye wòkpe aʋa kpli wo le Araba gbedzi ŋdi kanya, ke menya be
futɔwo de xa ɖe dua godo o. Yosua kple eƒe Israelviwo si to gbegbe la abe ɖe
nugbe menyo na wo o ene. Ale Ai fia ɖe gbe na eƒe asrafo siwo katã nɔ dua me la
be woati Israelviwo yome. Ale dutaʋlilawo vɔ le dua me; asrafo aɖeke kura meganɔ
Ai alo Betel o. Gawu la, woʋu Ai ƒe agbowo da ɖi siãa. Yehowa gblɔ na Yosua be,
“Tsɔ wò akplɔ do ɖe Ai lɔƒo, elabena matsɔ du la ana wò.” Yosua wɔ nenema. Esi
xadelawo kpɔ Yosua ƒe dzesia ko la, wolũ ɖe dua dzi, ge ɖe eme eye wotɔ dzoe.
Aitɔwo ƒe aʋawɔlawo nye kɔ kpɔ megbe, kasia wokpɔ dzudzɔ la wòyi ɖatɔ keke
dziŋgɔli. Mɔ aɖeke meganɔ anyi na sisi o, elabena Israelviwo, ame siwo si ɖo ta
gbegbe la, trɔ hena aʋawɔwɔ kpli wo azɔ. Yosua kple Israelviwo katã kpɔ be
yewoƒe amewo xɔ dua, eye wotɔ dzoe, eya ta wotrɔ hede asi Aitɔwo wuwu me.
Israelvi siwo nɔ Ai dua me la do go tso dua me, eye wode asi Aitɔwo wuwu me tso
megbe. Ale Aitɔwo tsi Israelviwo dome, eye wowu wo katã, ame ɖeka pɛ gɔ̃ hã
metsi agbe alo si o, negbe Ai fia, ame si wolé kplɔ vɛ na Yosua. Esi Israelviwo
wu Aitɔ siwo nɔ dua godo vɔ la, wotrɔ yi dua me, eye wowu ame siwo katã ganɔ dua
me. Ale wowu ame akpe wuieve (12,000) siwo nye Aitɔwo katã la gbe ma gbe. Yosua
lé eƒe akplɔ do ɖe Ai du la gbɔ va se ɖe esime wowu Aitɔ mamlɛa. Aitɔwo ƒe lãwo
kple kesinɔnuwo ko wometsrɔ̃ o, elabena Israelviwo ƒe aʋawɔlawo tsɔ wo na wo
ɖokuiwo. Yehowa ŋutɔe gblɔe na Yosua be woate ŋu atsɔ wo. Ale Ai trɔ zu gli
gbagbã siwo woli kɔe ɖi va se ɖe egbe. Yosua de ka ve na Ai fia ɖe ati aɖe ŋu,
ke esi ɣe nɔ to ɖom la, eɖee tsɔ ƒu gbe ɖe dua ƒe agbo ŋgɔ. Wofɔ kpe gãwo li kɔ
ɖe edzi. Kpeawo gali va se ɖe egbe.  Le esia megbe la, Yosua tu vɔsamlekpui aɖe
na Yehowa, Israel ƒe Mawu la ɖe Ebal to la gbɔ abe ale si Mose, Yehowa ƒe dɔla
ɖo na Israelviwo be woawɔ ene. Etui abe ale si woŋlɔe ɖe Mose ƒe Segbalẽ la me
ene be, “Tsɔ kpe siwo womegbã alo kpa o la tu vɔsamlekpui nam.” Yehowa gblɔ nya
sia tso Ebal to la ŋuti. Nunɔlawo sa numevɔ kple ŋutifafavɔ na Yehowa le
vɔsamlekpui la dzi. Yosua ŋlɔ Mose ƒe Se Ewoawo dometɔ ɖe sia ɖe ɖe vɔsamlekpui
la ƒe kpeawo dzi le Israelviwo ŋkume. Azɔ la, Israelviwo katã, woƒe ametsitsiwo,
kplɔlawo, ʋɔnudrɔ̃lawo kple amedzro siwo nɔ wo dome la ma ɖe akpa eve me. Akpa
ɖeka tsi tsitre ɖe Gerizim to la te, eye akpa evelia hã nɔ Ebal to la te.
Nunɔlawo kɔ nubablaɖaka la nɔ akpa eveawo dome hena yayranyawo xexlẽ. Wowɔ esia
abe ale si Mose ɖo na wo gbe aɖe gbe ene. Yosua xlẽ yayranya kple fiƒodenya siwo
katã Mose ŋlɔ ɖe Yehowa ƒe Segbalẽ la me la na wo. Exlẽ se siwo katã Mose de na
wo kpɔ la hã na ameha blibo la, si me nyɔnuwo, ɖeviwo kple amedzro siwo nɔ
Israelviwo dome la hã nɔ."
9,https://audio-bible-cdn.youversionapi.com/1184/32k/JOS/9-398e6de40539137c5a48fef98a33474e.mp3,"Ale si Israelviwo ɖu dukɔwo dzi la va ɖo to me na fia aɖewo. Fia siawo ƒe
dukɔwoe nye esiwo nɔ Yɔdan tɔsisi la ƒe ɣetoɖoƒe, dukɔ siwo nɔ towo kple togbɛwo
dzi, esiwo nɔ Domeƒu la ŋu kple esiwo nɔ dzigbeme heyi keke Lebanon. Dukɔ siawoe
nye Hititɔwo, Amoritɔwo, Kanaantɔwo, Perizitɔwo, Hivitɔwo kple Yebusitɔwo. Dukɔ
siawo ƒe aʋakɔwo wɔ ɖeka enumake hena aʋawɔwɔ kple Yosua kple Israelviwo. Ke
Gibeontɔwo, ame siwo nye Hivitɔwo la se nu si Yosua wɔ Yeriko kple Ai. Eya ta
woɖo be yewoaflu Yosua. Wodo agba na woƒe tedziwo kple kotoku xoxowo kple
waingolo vuvuwo. Wodo awu vuvuwo kple afɔkpa siwo te vuvu wogbugbɔ tɔ, eye abolo
si wotsɔ ɖe asi hã ƒu hedze fufu. Esi wova ɖo Israelviwo ƒe asaɖa me le Gilgal
la, wogblɔ na Yosua kple Israelviwo be, “Míetso teƒe didi aɖe; míedi be míawɔ
ŋutifafa kpli mi.” Israelviwo gblɔ na Hivitɔ siawo be, “Aleke míawɔ hafi anya be
menye teƒe kpui aɖee mietso o? Ne mietso kpuiƒe la, míate ŋu awɔ ŋutifafa kpli
mi o.” Woɖo eŋu be, “Míazu miaƒe kluviwo.” Yosua bia be, “Ame kawoe mienye eye
afi ka mietso?” Woɖo eŋu na Yosua be, “Wò dɔlawo tso anyigba didi aɖe dzi. Míese
nu tso Yehowa, miaƒe Mawu la ƒe ŋusẽ kple nu siwo katã wòwɔ le Egipte kpakple nu
si wòwɔ Amoritɔwo ƒe fia eveawo, Sixɔn, Hesbon fia kple Ɔg, Basan fia si nɔ
Astarot ŋu, eya ta míaƒe ametsitsiwo kple míaƒe amewo gblɔ na mí be, ‘Midzra ɖo
na mɔ didi aɖe zɔzɔ. Miyi Israelviwo gbɔ, eye miatsɔ míaƒe dukɔ na wo, ale be
míazu woƒe subɔlawo, eye miabia ŋutifafa.’ Woɖe abolo sia dzodzoe tso abolokpo
me teti ko míedze mɔ, ke fifia la, abe ale si miawo ŋutɔ miakpɔe ene la, eƒu
hedze fufu. Waingolo siawo nye nu yeyewo, ke fifia la, wodo xoxo hevuvu. Míaƒe
awuwo kple afɔkpawo vuvu le mɔzɔzɔ la ƒe didi kple sesẽ ta.” Amedzroawo na
nuɖuɖu Israelviwo, eye woxɔe abe ɖekawɔwɔ ƒe dzesi ene le esime womebia Yehowa
gbã tso eŋu o. Yosua wɔ ŋutifafa ƒe nubabla kple Gibeontɔwo, eye wòna be woatsi
agbe. Israelviwo ƒe kplɔlawo do ŋugbe be yewoawɔ ɖe nubabla la dzi. Nyateƒe la
va dze go le ŋkeke etɔ̃ megbe be Gibeontɔwo ƒe nɔƒe te ɖe Israelviwo ŋu
kpokploe. Israelviwo ƒe aʋakɔ dze mɔ enumake be yeaku nya la gɔme, eye woɖo woƒe
duwo me le ŋkeke etɔ̃ pɛ ko megbe. Woƒe duwo ƒe ŋkɔwoe nye: Gibeon, Kefira,
Beerot kple Kiriat Yearim, Ke Israelviwo metsrɔ̃ duawo o le adzɔgbe si
Israelviwo ƒe kplɔlawo ɖe le Yehowa, Israel ƒe Mawu la ƒe ŋkɔ me la ta.
Israelviwo do dɔmedzoe ɖe woƒe kplɔlawo ŋu le ŋutifafa ƒe nubabla la ta.
Kplɔlawo ɖo eŋu be, “Míeka atam le Yehowa, Israel ƒe Mawu la ƒe ŋkɔ me be míawɔ
nuvevi wo o, eya ta míaka asi wo ŋu hã o. Ele be míana woanɔ agbe, elabena ne
mietu míaƒe atam la la, Yehowa ado dɔmedzoe ɖe mia ŋu.” Ale Gibeontɔwo zu
kluviwo na Israelviwo, wozu nakefɔlawo kple tsidulawo na wo. Yosua yɔ Gibeon ƒe
kplɔlawo, eye wòbia wo be, “Nu ka ta mieble mí be miaƒe anyigba le didiƒe, le
afi aɖe ke, le esime wònye ele kpuiƒe, afi sia ko le mía dome ɖo? Fifia la,
fiƒode ava mia dzi; tso egbe sia dzi la, miazu subɔlawo na mí. Ɣe sia ɣi miafɔ
nake, adu tsi na mí hena subɔsubɔdɔwo wɔwɔ na Mawu.” Gibeontɔwo ƒe kplɔlawo ɖo
eŋu be, “Míeble mi nenema, elabena míese be Yehowa ɖo na eƒe dɔla, Mose be wòaɖu
anyigba blibo la dzi, eye wòatsrɔ̃ ameawo katã le anyigba la dzi. Ale míevɔ̃ mi,
ɖe míaƒe agbe ta, eya ta míeble mi nenema ɖo. Ke azɔ la, míele miaƒe asi me,
miwɔ nu si dze mia ŋu la kpli mí.” Yosua meɖe mɔ na Israelviwo be woawu
Gibeontɔwo o, ke boŋ wozu nakefɔlawo kple tsidulawo na Israelviwo. Woawoe adu
tsi na Yehowa ƒe subɔsubɔdɔwɔwɔ le afi sia afi si woawɔ subɔsubɔdɔ le ko. Ɖoɖo
sia gale edzi kokoko va se ɖe egbe."
10,https://audio-bible-cdn.youversionapi.com/1184/32k/JOS/10-d1d5773d5fe51f8dcb6e28b7d5337eab.mp3,"Esi Adoni Zedek, Yerusalem fia se ale si Yosua xɔ Ai du, tsrɔ̃e gbidigbidi, eye
wòwu Ai fia kple ale si wòwɔ Ai fia kple Yeriko fia kpakple ale si Gibeontɔwo wɔ
nubabla kple Israelviwo, eye wozu Israel dzi nɔlawo la, vɔvɔ̃ gã aɖe ɖoe,
elabena Gibeon lolo abe fiadu ene, eye wòlolo sãa wu Ai, evɔ Gibeontɔwo nye
aʋawɔla sesẽwo, eya ta Adoni Zedek, Yerusalem fia ɖo du ɖe fia siawo: Hebron
fia, Hoham, Yarmut fia, Piran, Lakis fia, Yafia kple Eglon fia, Debir. Fia Adoni
Zedek gblɔ na wo be, “Miva kpe ɖe ŋunye míatsrɔ̃ Gibeontɔwo, elabena wowɔ
ŋutifafa kple Yosua kple Israelviwo.” Ale Amoritɔwo ƒe fia atɔ̃ siawo ƒo ƒu woƒe
aʋakɔwo katã ɖekae be yewoaho aʋa ɖe Gibeontɔwo ŋu. Gibeontɔwo ɖo ame ɖe Yosua
le Gilgal enumake be, “Miva kpe ɖe miaƒe subɔlawo ŋu! Miva kaba ne miava ɖe mí!
Amoritɔwo ƒe fiawo katã tso woƒe nɔƒewo le toawo dzi va le mía gbɔ kple woƒe
aʋakɔwo.” Yosua kple Israelviwo ƒe aʋakɔ la ho tso Gilgal, eye woyi be yewoaxɔ
na Gibeontɔwo. Yehowa gblɔ na Yosua be, “Mègavɔ̃ wo o, elabena mieɖu wo dzi
xoxo! Metsɔ wo na mi be miatsrɔ̃ wo, wo dometɔ ɖeka pɛ gɔ̃ hã mate ŋu anɔ te ɖe
mia nu o.” Yosua kple Israelviwo ƒe aʋakɔ la zɔ mɔ zã blibo la tso Gilgal, eye
woɖi ɖe futɔwo dzi kpoyi. Tete Yehowa na futɔwo vɔ̃ eye wotɔtɔ, ale Israelviwo
wu ame geɖewo le Gibeon, eye wonya ame mamlɛawo, nɔ wo wum le mɔa dzi yi keke
Bet Horon kple Azeka kple Makeda. Esi futɔwo nɔ sisim tso toawo dzi henɔ abu ɖim
la, Yehowa na kpewo ge tso dziƒo va dze wo dzi hetsrɔ̃ wo le mɔa dzi va se ɖe
keke Azeka ke. Ame siwo kpe siawo wu la sɔ gbɔ wu ame siwo Israelviwo wu kple
yi.  Esime Israelviwo nɔ Amoritɔwo nyam, nɔ wo wum la, Yosua do gbe ɖa na Yehowa
kple gbe sesẽ be, “Na ɣe natɔ ɖe Gibeon tame, eye nàna ɣleti hã natɔ ɖe Aiyalon
balime tame!” Eye ɣe kple ɣleti siaa megaʋã o va se ɖe esime Israelviwo ƒe aʋakɔ
la tsrɔ̃ eƒe futɔwo keŋkeŋ! Woŋlɔ nu geɖewo wu esia tso aʋa sia wɔwɔ ŋuti ɖe
Yasar ƒe Agbalẽ me. Ale ɣe tɔ ɖe dziƒo abe gaƒoƒo blaeve-vɔ-ene sɔŋ ene! Ŋkeke
sia tɔgbi meva yi kpɔ o, eye etɔgbi megava kpɔ o tso gbe ma gbe, esi Yehowa tɔ
ɣe kple ɣleti le ame ɖeka ƒe gbedodoɖa ta. Ke Yehowa nɔ aʋa wɔm na Israel. Le
esia megbe la, Israelviwo ƒe aʋakɔ la trɔ yi Gilgal.  Amoritɔwo ƒe fia atɔ̃awo
si le aʋa la me yi ɖaɣla wo ɖokuiwo ɖe agado aɖe me le Makeda. Esime wona nyanya
Yosua be wokpɔ fiawo la, eɖe gbe be woamli kpe gã aɖe axe agado la nu, eye woana
dzɔlawo nanɔ afi ma akpɔ egbɔ be fiawo tsi agado la me. Yosua ɖe gbe na aʋakɔ la
be, “Minɔ futɔwo nyanya dzi, eye miawu wo tso megbe; migana woade woƒe duwo me
o, elabena Yehowa miaƒe Mawu akpe ɖe mia ŋu miatsrɔ̃ wo keŋkeŋ.” Ale Yosua kple
Israelʋakɔ la yi futɔwo wuwu dzi. Wotsrɔ̃ aʋakɔ atɔ̃awo katã negbe ame ʋɛ aɖewo
koe te ŋu ɖo woƒe du siwo woɖo gli ƒo xlã la me. Le esia megbe la, Israelviwo
gbugbɔ yi woƒe asaɖa me le Makeda. Womewu aʋawɔla ɖeka pɛ gɔ̃ hã le wo dome o!
Tso esia dzi la, futɔ aɖeke megaho aʋa ɖe Israelviwo ŋu kpɔ o. Yosua ɖe gbe be
woaɖe kpe gã la ɖa le agado la nu, eye woakplɔ fia atɔ̃awo vɛ. Ale woʋu agado
la, eye wokplɔ Yerusalem, Hebron, Yarmut, Lakis kple Eglon fiawo vɛ. Esi wokplɔ
fia atɔ̃ siawo va Yosua gbɔ la, eyɔ Israel ŋutsuwo katã eye wòɖe gbe na eƒe
aʋakplɔlawo, ame siwo de aʋa kplii be, “Mite va eye miaɖo afɔ ve dzi na fia
siawo!” Tete wote va eye woɖo afɔ ve dzi na fia atɔ̃awo. Yosua gblɔ na
Israelviwo be, “Migavɔ̃ gbeɖegbeɖe o. Ŋusẽ nenɔ mia ŋu, eye mialé dzi ɖe ƒo,
elabena Yehowa awɔ miaƒe futɔwo katã alea.” Tete Yosua tsɔ eƒe yi wu fia
atɔ̃awo, eye wòde ka wo ɖe ati atɔ̃ ŋu va se ɖe fiẽ. Esime ɣe nɔ to ɖom la,
Yosua na woɖe wo le atiawo ŋu, wotsɔ wo ƒu gbe ɖe agado si me wosi yi ɖaɣla wo
ɖokuiwo ɖo la me, eye woli kɔ kpe gãwo ɖe agado la nu. Kpe siawo gale afi ma va
se ɖe egbe. Gbe ma gbe ke la, Yosua tsrɔ̃ Makeda du la, eye wòwu fia la kple ame
sia ame si nɔ dua me; womena ame ɖeka pɛ gɔ̃ hã tsi agbe le du blibo la me o.
Tso afi sia la, Israelviwo yi Libna. Yehowa tsɔ du la kple fia la de asi na
Israel le afi sia hã; wowu ame sia ame le dua me abe ale si wowɔ le Yeriko ene.
Israelviwo tso Libna, eye woyi ɖadze Lakis du la hã dzi. Yehowa tsɔ du sia hã na
Israel le ŋkeke evelia dzi. Wowu ame sia ame le afi sia hã abe ale si wowɔ le
Libna ene. Esime Israelviwo nɔ aʋa wɔm le Lakis la, Gezer fia Horan va do kple
eƒe aʋakɔ be yeaʋli Lakis du la ta. Ke Yosua ƒe amewo wui, eye wotsrɔ̃ eƒe aʋakɔ
blibo la. Yosua kple Israel katã dzo le Lakis heyi Eglon. Woɖe to ɖe du sia, eye
woho aʋa ɖe eŋu. Woxɔ du sia hã gbe ma gbe ke, eye wowu ame sia ame abe ale si
wowu Lakistɔwo katã ene. Esi wodzo le Eglon la, woyi Hebron. Woxɔ du sia kple du
sue siwo ƒo xlãe, eye wowu ameawo katã kple woƒe fia; womena ame ɖeka pɛ gɔ̃ hã
tsi agbe o. Wotrɔ azɔ yi Debir. Woɖu Debirtɔwo dzi enumake, wu ame sia ame abe
ale si wowɔ le Libna ene. Ale Yosua kple eƒe aʋakɔ la woɖu anyigba blibo la dzi;
woɖu dukɔ siwo nɔ toawo dzi, esiwo nɔ anyigba sɔsɔe dzi kple esiwo nɔ toawo ŋu
la dzi. Wowu ame sia ame le anyigba la dzi, abe ale si Yehowa, Israel ƒe Mawu la
ɖo na wo be woawɔ ene. Wowu wo tso Kades Barnea yi Gaza, tso Gosen yi Gibeon.
Wowɔ nu siawo katã le aʋadzedze ɖeka pɛ ko me, elabena Yehowa, Israel ƒe Mawu la
nɔ aʋa wɔm na wo. Le dziɖuɖu siawo megbe la, Yosua kple Israel blibo la trɔ yi
asaɖa la me le Gilgal."
11,https://audio-bible-cdn.youversionapi.com/1184/32k/JOS/11-b17237e79b00fc667f364349f2c1fabf.mp3,"Esi Yabin, Hazor fia se ale si Israelviwo nɔ dukɔwo dzi ɖum la, eɖo du ɖe Yobab,
Madɔn fia kple Simron fia kple Aksaf fia, kple fia siwo nɔ tonyigba la dzi le
dziehe le Araba, le Kineret kple esiwo nɔ Yɔdan tɔsisi la ƒe balime le Galilea
ƒu la ƒe dziehe kple fia siwo nɔ ɣetoɖoƒetogbɛwo dzi le ƒuta, te ɖe Nafɔt Dor
ŋu. Eɖo du ɖe Kanaan fia siwo nɔ Yɔdan tɔsisi la ƒe akpa eveawo dzi, Amoritɔwo,
Hititɔwo, Perizitɔwo kple Yebusitɔwo le tonyigba la dzi kple Hivitɔwo, ame siwo
nɔ Hermon to la dzi le Mizpanyigba dzi. Dukɔ siawo katã kplɔ woƒe aʋakɔwo vɛ,
eye woƒo ƒu zu aʋakɔ gã ɖeka ɖe Israel ŋu. Aʋakɔ gã sia kple woƒe sɔwo kple
tasiaɖamwo sɔ gbɔ abe ƒutake ene. Woƒu asaɖa anyi ɖe Merɔn tsi dzidzi la gbɔ.
Yehowa gblɔ na Yosua be, “Mègavɔ̃ aʋakɔ gã sia o, elabena etsɔ hafi ɣelawoɣi
naɖo la, wo katã woazu nu kukuwo le Israel ŋgɔ! Gbã la, tu woƒe sɔwo ƒe atawo,
eye nàtɔ dzo woƒe tasiaɖamwo!” Yosua kple eƒe amewo va dze futɔwo dzi le vo me
le Merɔn tsi dzidzi la gbɔ. Yehowa tsɔ aʋakɔ gã ma de asi na Israelviwo, eye
wonya wo va se ɖe keke Sidon du gã la me kple Misrefat Maim heyi Mizpa balime le
ɣetoɖoƒe lɔƒo. Futɔwo dometɔ aɖeke metsi agbe o. Yosua kple eƒe amewo tu ata na
futɔwo ƒe sɔwo, eye wotɔ dzo woƒe tasiaɖamwo abe ale si Yehowa ɖo na wo ene. Esi
wotrɔ gbɔna la, Yosua xɔ Hazor du, si nye fiadu na dukɔ ƒoƒu mawo katã, eye wòwu
eƒe fia. Wowu ame sia ame le Hazor du la me, eye wotɔ dzo du la. Yosua dze fia
mamlɛawo ƒe du bubuawo dzi. Wowu ameawo katã abe ale si Mose gblɔe da ɖi xoxo la
ene. Ke Yosua metɔ dzo du siwo nɔ togbɛwo dzi la ya o, negbe Hazor ko.
Israelviwo ha du siwo wotsrɔ̃ la ƒe nuwo kple lãwo na wo ɖokuiwo, ke wowu
amegbetɔwo katã, elabena nenemae Yehowa ɖo na eƒe dɔla, Mose, eya hã gblɔ ɖoɖo
ma na Yosua, eye eya hã wɔ nu si wogblɔ nɛ. Yosua wɔ se siwo katã Yehowa de na
Mose la dzi. Ale Yosua ɖu anyigba blibo la dzi. Exɔ Negeb kple Gosenyigba kple
Araba kple Israel ƒe tonyigbawo kple sɔsɔeƒewo. Ale Israelviwo ƒe anyigba keke
azɔ tso keke Halak to la gbɔ te ɖe Seir ŋu yi Baal Gad le Lebanon ƒe balime le
Hermon to la te. Yosua wu teƒe mawo ƒe fiawo katã. Yosua tsɔ ƒe adre wɔ nu siawo
katã. Israelviwo mewɔ ŋutifafa kple du aɖeke me tɔwo o, negbe Hivitɔ siwo nɔ
Gibeon ko. Wowu ame bubuawo katã, elabena Yehowa ɖo be dukɔ mawo nadi be yewoawɔ
aʋa boŋ kple Israelviwo ɖe ŋutifafawɔwɔ teƒe. Eya ta wotsrɔ̃ wo
nublanuimakpɔmakpɔtɔe abe ale si Yehowa ɖo na Mose ene. Le ɣeyiɣi sia me la,
Yosua tsrɔ̃ ame dzɔatsu siwo nye Anak ƒe dzidzimeviwo, ame siwo nɔ tonyigbawo
dzi le Hebron, Debir, Anab, Yuda kple Israel. Ewu wo katã keŋkeŋ, eye wòtsrɔ̃
woƒe duwo gbidigbidi. Wo dometɔ aɖeke megasusɔ ɖe Israelnyigba dzi o, ke ɖewo
ganɔ Gaza, Gat kple Asdod. Ale Yosua xɔ anyigba blibo la abe ale si Yehowa ɖo na
Mose ene. Etsɔe na Israelviwo abe woƒe domenyinu ene, eye wòmae ɖe toawo dome.
Ale aʋawɔwɔ nu tso le anyigba la dzi."
12,https://audio-bible-cdn.youversionapi.com/1184/32k/JOS/12-079f427cca7516e7bc454a12f4923793.mp3,"Fia siwo dzi Israelviwo ɖu le Yɔdan tɔsisi la ƒe ɣedzeƒe lɔƒo, ame siwo ƒe duwo
wogbã tso keke Arnon tɔsisi la ƒe balime va yi Hermon to la gbɔ kple du siwo le
gbegbe siwo le ɣedzeƒe la woe nye esiawo:  Amoritɔwo ƒe fia Sixɔn, ame si nɔ
Hesbon la ƒe fiaɖuƒe keke tso Aroer le Arnon balime gbɔ kple tso Arnon tɔsisi la
ƒe balime ƒe titina yi ɖatɔ Yabok tɔsisi la si nye Amonitɔwo ƒe liƒo dzi.
Gileadnyigba si le Yabok tɔsisi la ƒe dzigbeme egbe la ƒe afã nɔ Sixɔn ƒe
anyigba me. Anyigba si tso Araba yi Galilea ƒu la ƒe ɣetoɖoƒeliƒo dzi heyi
anyigbeme ɖatɔ Araba ƒu si nye (Dzeƒu la) heɖo ta Bet Yesimot, va se ɖe Pisga
towo ƒe dziehe ŋu la hã nɔ Fia Sixɔn te. Woɖu Ɔg, Basan fia, ame si nye Refaim
ƒe dzidzimeviwo ƒe mamlɛtɔ nɔ Astarot kple Edrei hã dzi. Eɖu anyigba si tso
Hermon to la gbɔ le dzigbeme yi Saleka le Basan to la gbɔ le ɣedzeƒe va yi ɖatɔ
Gesur kple Maka fiaɖuƒewo ƒe liƒowo dzi le ɣetoɖoƒe lɔƒo la dzi. Ɔg ƒe fiaɖuƒe
yi anyigbeme lɔƒo kple Gileadnyigba ƒe afã le dzigbeme gome, ɖatɔ Fia Sixɔn, fia
si nɔ Hesbon la ƒe anyigba.  Mose kple Israelviwo tsrɔ̃ ame siawo xoxo, eye Mose
tsɔ anyigba la na Ruben ƒe viwo kple Manase ƒe viwo ƒe afã.  Fia siwo ƒe anyigba
Yosua kple Israelviwo xɔ le Yɔdan tɔsisi la ƒe ɣetoɖoƒe la ƒe ŋkɔwoe nye esiwo
gbɔna. Anyigba la tso Baal Gad le Lebanon ƒe balime yi Balak to la gbɔ le Seir
to la ƒe ɣetoɖoƒe. Yosua tsɔ anyigba sia na Israelviwo ƒe to bubuawo me tɔwo.
Teƒe siwo le toawo dzi, togbɛ ɣedzeƒetɔwo dzi, Yɔdan ƒe balime kple eƒe togbɛwo
dzi, ɣedzeƒetowo kɔgo kple Negebnyigba la katã le anyigba sia me. Hititɔwo,
Amoritɔwo, Kanaantɔwo, Perizitɔwo, Hivitɔwo kple Yebusitɔwo nɔ anyigba sia dzi
tsã.  Israelviwo ɖu du siawo ƒe fiawo dzi:  Yeriko fia ɖeka, Ai, si te ɖe Betel
ŋu fia ɖeka, Yerusalem fia ɖeka, Hebron fia ɖeka, Yarmut fia ɖeka, Lakis fia
ɖeka, Eglon fia ɖeka, Gezer fia ɖeka, Debir fia ɖeka, Geder fia ɖeka, Horma fia
ɖeka, Arad fia ɖeka, Libna fia ɖeka, Adulam fia ɖeka, Makeda fia ɖeka, Betel fia
ɖeka, Tapua fia ɖeka, Hefer fia ɖeka, Afek fia ɖeka, Lasarɔn fia ɖeka, Madɔn fia
ɖeka, Hazor fia ɖeka, Simrɔn Merɔn fia ɖeka, Aksaf fia ɖeka, Taanak fia ɖeka,
Megido fia ɖeka, Kedes fia ɖeka, Yokneam le Karmel fia ɖeka, Nafɔt Dor le ƒuta
fia ɖeka. Goim le Gilgal fia ɖeka kple Tirza fia ɖeka.  Ale wotsrɔ̃ fia
blaetɔ̃-vɔ-ɖekɛ kple woƒe duwo."
13,https://audio-bible-cdn.youversionapi.com/1184/32k/JOS/13-9380b4dd531423ea5b3f08f5db3c895b.mp3,"Yosua tsi heku amegã azɔ, eye Yehowa gblɔ nɛ be, “Fifia, èzu amegãɖeɖi, evɔ dukɔ
geɖewo gali siwo dzi wòle be miaɖu.  “Anyigba siwo kpɔtɔ la woe nye:  “Filisti
kple Gesur dukɔwo ƒe anyigba si tso Sixor tɔsisi la gbɔ le Egipte ƒe liƒo dzi
heyi anyiehe ke, elabena wobu anyigba si va tɔ Ekron ƒe liƒo la abe Kanaantɔwo
ƒe anyigba ene. Filistitɔwo ƒe fiawo nɔ Gaza, Asdod, Askelon, Gat kple Ekron;
hekpe ɖe Avitɔwo ŋu le dziehe; Kanaantɔwo ƒe anyigba la katã gali kpe ɖe Ara, si
nye Sidontɔwo tɔ heyi keke Afek le Amoritɔwo ƒe liƒo dzi ŋu. Gebalitɔwo ƒe
anyigba kple Lebanonyigba blibo la ɖo ta ɣedzeƒe, tso Baal Gad, si le Hermon to
la ƒe anyigbeme heyi Hamat mɔ la nu.  “Sidontɔwo, ame siwo le tonyigba la dzi le
Lebanon towo kple Misrefat Maim dome la ƒe anyigba hã le eme. Mele klalo be
manya dukɔ siawo katã ɖa le Israel dukɔ la ŋgɔ, eya ta bu anyigba siawo katã abe
mia tɔwo ene, eye nàmae na Israel ƒe to asiekɛawo kple Manase ƒe to afã la abe
ale si meɖo na wò ene.”  Manase ƒe to la ƒe afã kple Ruben ƒe viwo kple Gad ƒe
viwo xɔ woƒe domenyinu le Yɔdan tɔsisi la ƒe ɣedzeƒe xoxo, elabena Mose tsɔ
anyigba sia na wo. Woƒe anyigba la nye teƒe si tso Areor, le Arnon tɔsisi la ƒe
balime ƒe toga kple du siwo le balime la, to Medeba ƒe togbɛnyigba dzi yi Dibon.
Sixɔn, Amoritɔwo ƒe fia, ame si ƒe fiadu nye Hesbon la ƒe duwo hã nɔ anyigba la
me, eye wòtso eme yi keke Amon ƒe liƒowo dzi. Gilead kple anyigba si nye
Gesuritɔwo kple Makatitɔwo tɔ kple Hermon to la, Basan to la kple Saleka du la
kple Ɔg, Basan fia, ame si ɖu fia le Astarot kple Edrei la ƒe anyigba. Eyae nye
Refaimtɔ mamlɛtɔ, elabena Mose ho aʋa ɖe wo ŋu, eye wònya wo ɖa le anyigba la
dzi. Ke Israelviwo menya Gesuritɔwo alo Makatitɔwo o, eya ta wogale Israelviwo
dome va se ɖe egbe.  Ale si woma anyigba na Israel ƒe to vovovoawo la yi ale:
Levitɔwo: Mose mena anyigba aɖeke Levitɔwo o, ke boŋ etsɔ vɔsanu siwo ameawo
atsɔ vɛ na Yehowa, Israel ƒe Mawu la na wo.  Ruben ƒe to: Mose na anyigba Ruben
ƒe to la ɖe ƒome siwo le to la me la ƒe agbɔsɔsɔ nu. Ruben ƒe viwo ƒe anyigba
tso Aroer le Arnon tɔsisi la ƒe balime ƒe toga, dze le Arnon du si le balime la
ƒe titina la ŋu va dze le Medeba ƒe togbɛwo ŋu. Du siwo nɔ afi ma la woe nye
Hesbon kple du bubu siwo le gbadzaƒe: Dibon, Bamɔt Baal, Bet Baal Meon, Yaza,
Kedemot, Mefaat, Kiriataim, Sibma, Zeret Sabar si le to aɖe dzi le balime la
tame, Bet Peor, Bet Yesimot kple Pisga to la kɔgo. Du siwo nɔ togbɛwo dzi kple
Fia Sixɔn ƒe fiaɖuƒe me la hã nɔ Ruben ƒe viwo ƒe anyigba dzi. Sixɔn nye
Amoritɔwo ƒe fia si nɔ Hesbon. Mose wu Fia Sixɔn kple Midian fia bubu siawo:
Evi, Rekem, Zur, Hur kple Reba. Israelviwo hã wu afakala Balaam si nye Beor ƒe
vi la hã. Yɔdan tɔsisi lae nye Ruben ƒe viwo ƒe anyigba la ƒe liƒo le ɣedzeƒe
lɔƒo.  Gad ƒe to: Mose na anyigba Gad ƒe viwo ƒe to la ɖe ƒome siwo le to la me
ƒe agbɔsɔsɔ nu. Yazer kple Gilead ƒe duwo katã kple Amonyigba ƒe afã heyi Aroer
le Raba gbɔ nɔ Gad ƒe viwo ƒe anyigba la me. Anyigba la gatso Hesbon yi Ramat
Mizpa kple Betonim, eye wògatso Mahanaim yi Lo Debir. Teƒe siwo le anyigba sia
me le Yɔdan tɔsisi la ƒe balime la woe nye: Bet Haram, Bet Nimra, Sukɔt, Zafɔn
kple Fia Sixɔn, ame si nɔ Hesbon la ƒe anyigba mamlɛa. Anyigba la ƒe liƒo le
ɣetoɖoƒe lae nye, Yɔdan tɔsisi la yi anyigbeme va ɖo keke Galilea ƒu la ƒe
dzigbeme. Esiawoe nye du siwo wotsɔ na ƒome siwo le Gad ƒe to la me abe woƒe
domenyinu ene.  Mose na anyigba Manase viwo ƒe to la ƒe afã le woƒe ƒomewo nu.
Ena anyigba wo tso Mahanaim. Basan blibo si nye Fia Ɔg ƒe fiaɖuƒe kple Yair kple
Basan ƒe du blaade nɔ to sia ƒe anyigba me. Wotsɔ Gilead ƒe afã, Astarot kple
Edrei (du siwo le Ɔg, Basan fia ƒe fiaɖuƒe me), na Makir, Manase ƒe viwo ƒe to
la ƒe afã. Esiawoe nye anyigba siwo wotsɔ na Manase ƒe vi Makir ƒe to la ƒe afã
le woƒe ƒome nu.  Aleae Mose ma anyigba si le Yɔdan tɔsisi la ƒe ɣedzeƒe, afi si
ameawo ƒu asaɖa anyi ɖo ɣe ma ɣi le Yeriko gbɔ. Mose mena anyigba aɖeke Levitɔwo
o, elabena abe ale si wòɖe eme na woe ene la, Yehowa Mawu lae nye woƒe
domenyinu, Yehowa koe nye nu si wohiã. Yehowa ŋutɔ akpɔ wo ta abe ale si dze
ene."
